handle,text
AP,"Britney Spears has married her longtime partner Sam Asghari months after the pop superstar won her freedom from a court conservatorship. Spears’ first husband, a childhood friend, was arrested after attempting to crash their wedding. https://t.co/CWvOyzdmNY"
AP,"Footage from the Jan. 6 hearing showed leaders of the extremist Oath Keepers and Proud Boys preparing to storm the U.S. Capitol.

Testifying in person was one of the officers, Caroline Edwards, who suffered serious injuries as she battled the mob. https://t.co/ruq6ee0xEE https://t.co/HGdI3mCRmJ"
AP,"Rep. Liz Cheney, the panel’s vice chair, spoke directly to her GOP colleagues during the hearing on the Jan. 6 attack: ""I say this to my Republican colleagues who are defending the indefensible: There will come a day when Donald Trump is gone, but your dishonor will remain."" https://t.co/URkCmEnDQg"
AP,"In its first public hearing, a House panel laid the blame for Jan. 6 firmly on Donald Trump, saying the assault on the Capitol was an “attempted coup.” https://t.co/Lyw2w6mDMP"
AP,"""It was carnage. It was chaos. ... Never in my wildest dreams did I think that as a police officer, as a law enforcement officer, I would find myself in the middle of a battle.""

U.S. Capitol Police Officer Caroline Edwards describes ""absolute war zone"" outside of the Capitol. https://t.co/Rs4FU3CqKW"
AP,"Takeaways from the Jan. 6 committee hearing: 
• The panel says former President Trump led a “sprawling, multi-step conspiracy.” 
• Members of Trump's inner circle – including his daughter Ivanka Trump – cast doubt on his claims of a stolen election.
https://t.co/hyA2LfPQGJ"
AP,"Caroline Edwards, a U.S. Capitol Police officer who was seriously injured at the Jan. 6 attack, says during the hearing: “I, whose literal blood, sweat and tears were shed that day defending the building that I spent countless holidays and weekends working in."" https://t.co/m7Rtd9Fmnw"
AP,Former Interior Secretary Ryan Zinke has won an unexpectedly tight race to become the Republican nominee in the race for a new U.S. House seat representing western Montana. Zinke was endorsed by former President Donald Trump. https://t.co/Ac3GTYZPhe
AP,"The chairman of the House committee investigating the Jan. 6 Capitol insurrection declared at Thursday’s prime-time hearing that the attack was an “attempted coup” that put “two and half centuries of constitutional democracy at risk."" https://t.co/YKlKS0vcVm https://t.co/TEOtpT28Gm"
AP,"In a prime-time hearing, the House committee investigating the Jan. 6 attack on the U.S. Capitol is going public with its findings. Watch live. https://t.co/bYuz5YmzM3"
AP,"House committee airs violent, previously unseen footage of rioters beating police and smashing their way into the U.S. Capitol on Jan. 6 during its first public hearing. https://t.co/0wXwJQCsm6"
AP,"Vice chair Liz Cheney, R-Wyo., read an account that said when Trump was told the Capitol mob was chanting for Vice President Mike Pence to be hanged, Trump responded that maybe they were right, that he “deserves it.” https://t.co/rbNR5h1HZu"
AP,"Rep. Liz Cheney, during Thursday’s hearing on the Jan. 6 attack on the U.S. Capitol, says “there’s no doubt that President Trump was well aware of the violence as it developed.”

As part of the hearing, the panel will outline Trump’s actions that day. https://t.co/swqpos1irG https://t.co/KksIXv4UpR"
AP,Former Attorney General Bill Barr testified that he told President Trump claims of a rigged election were “bull——.” Barr's testimony was played during the House Jan. 6 committee's first public hearing. https://t.co/vgucnB55Al
AP,"More than 800 people across the U.S. have been charged in the Jan. 6 riot at the U.S. Capitol.

A look at where the criminal cases stand as the House committee begins holding a series of public hearings.

https://t.co/Ly0oEqxIS7"
AP,"Rep. Bennie Thompson, chairman of the House committee investigating the Jan. 6 Capitol insurrection, opens Thursday’s hearing, saying: “Jan. 6 was the culmination of an attempted coup.”

Thompson warned that democracy ""remains in danger"" from a ""conspiracy"" that fueled the riot. https://t.co/cExbSTN9qc"
AP,Watch live: Jan. 6 House committee reveals its findings from an 11-month investigation into the insurrection at the U.S. Capitol.https://t.co/utrNaI7uHU https://t.co/bYuz5YDCO3
AP,"The chairman of the House Jan. 6 committee says the attack put ""two and half centuries of constitutional democracy at risk,” in comments prepared for a prime-time hearing. The panel is releasing findings from its investigation into the Capitol attack. https://t.co/0jBjXVyFbx"
AP,This video replaces a previous version to show that American planes did not drop the napalm in Vietnam. South Vietnamese planes did.
AP,"When @AP photographer Nick Ut captured Kim Phuc's image after a South Vietnamese napalm strike, she became a symbol of the war and its human toll.

They are close friends now and reunited this week to look at original negatives from that day 50 years ago. https://t.co/o4ECFBdBkQ https://t.co/lBQdb5NSjA"
AP,"Millions of COVID-19 vaccine doses have been ordered for kids under 5 in anticipation of possible federal authorization next week, White House officials say. https://t.co/W1gdyCOlhy"
AP,"The House panel investigating the Jan. 6 insurrection will attempt to show the “harrowing story” of the deadly violence of that day and a chilling backstory as the defeated president, Donald Trump, tried to overturn Joe Biden’s election victory. https://t.co/yLshjfpUrb"
AP,"WHO concluded last year that it was “extremely unlikely” COVID-19 spilled into humans from a lab.

Many scientists suspect it came from bats, but WHO says key pieces of data are missing before it can name an origin. https://t.co/rlyYgRoOAd"
AP,"Over two years after the coronavirus was first detected in China, the World Health Organization recommended in its strongest terms yet that a deeper investigation is required into whether a lab accident may be to blame. https://t.co/Fq1QumONWJ"
AP,"House Speaker Nancy Pelosi said Thursday the House stands ready to consider gun legislation from the Senate ""if it’s life-saving and can make a difference, and they have bipartisan support for it."" https://t.co/xRMAh6ca79 https://t.co/AwYGITOgiL"
AP,"President Joe Biden, speaking at the Summit of the Americas, looked ahead to the primetime Jan. 6 committee hearing and commented on the attack on the U.S. Capitol.

""I think it was a clear, flagrant violation of the Constitution,"" he said. https://t.co/cvRftJu6AF"
AP,"Officers are rarely charged with crimes in civilian deaths, and it's even rarer for them to be convicted. Still, some recent cases have ended with guilty verdicts.

Here’s a look at the outcomes of some high-profile killings by police: https://t.co/osM1tHX0oG"
AP,Bottles of the popular Sriracha hot sauce could be hard to find on store shelves this summer due to a shortage of chili peppers. https://t.co/3EczgmVjK1
AP,"The shooting at Columbia Machine Inc. in Smithsburg left three dead, authorities said.

The suspect as well as a state trooper were wounded in the pursuit that followed. https://t.co/xDypXHso36"
AP,"Supreme Court financial disclosures reveal that the justices took in $800,000 in book royalties last year, a lucrative supplement to their judicial salaries.

The largest payment by far went to Justice Amy Coney Barrett. https://t.co/ENasy1IMed"
AP,"Almost a year after its inception, the Jan 6. House committee will go public with its findings as lawmakers hope to show the American public how democracy came to the brink of disaster.

Watch Thursday’s hearing at 8 p.m. ET on https://t.co/vcd0qvTqvX. https://t.co/lWRxiP4434"
AP,"""Russian soldiers drink vodka, we are making music."" 

A Ukrainian rapper and soldier gives voice to the hatred of Russia felt by young Ukrainians, now venting their fury in song, art, tattoos and fundraising for the war effort. By @johnleicester in Kyiv: https://t.co/AXnDonHjL8 https://t.co/yZJ3Db9HqH"
AP,"BREAKING: Authorities say a shooting at a business in Smithsburg, Maryland, has multiple victims but the suspect is no longer an active threat.

The sheriff’s office declined to elaborate on the number of victims or the extent of injuries. https://t.co/msEGaua8bW"
AP,Hawaii photographer Clark Little is known for his stunning images from inside some of the most powerful and dangerous waves on Earth. The Oahu native just released a new book that chronicles years of capturing the beauty of the ocean. https://t.co/GUrLkkYWqZ https://t.co/gXnKM1Ao0H
AP,"More than 800 people across the U.S. have been charged in the Jan. 6 riot at the U.S. Capitol. 

A look at where the criminal cases stand as the House committee investigating the attack prepares to hold a series of public hearings. https://t.co/lGyistXJ86"
AP,"A Chicago man who jumped onto train tracks to rescue someone who had fallen onto an electrified rail during a fight at an L station earned more than praise for his heroic act: He’s also been gifted with a 2009 Audi A8.

https://t.co/QUmbfKudYW"
AP,"The benefits provided by four giant hydroelectric dams on the lower Snake River in Washington state can be replaced if the dams are breached to save endangered salmon runs, according to a new report released Thursday. But it would be expensive.

https://t.co/kUQDddLa0l"
AP,"Food import bills will reach a record high this year and food markets are likely to tighten around the world, according to a glum new forecast by a U.N. food agency.

https://t.co/7TTEvVpLoF"
AP,"Owliyo Hassan Salaad has watched four of her children die this year. A drought in the Horn of Africa has taken them, one by one.

Authorities in Somalia, Ethiopia and Kenya are now shifting to the grim task of trying to prevent famine. https://t.co/VSNmXrVdjD https://t.co/k53ODDL0MR"
AP,"A Michigan police officer who killed Patrick Lyoya, a Black man, with a shot to the back of his head has been charged with second-degree murder. prosecutors said.

https://t.co/tpiXDMwRNp"
AP,"What did then-President Donald Trump do and say during the Capitol riot? Large gaps remain in the public record, including an almost eight-hour gap in the official White House record of Trump’s phone calls.  

Here’s what we know so far. https://t.co/HP78YxnEGK"
AP,"Facebook has failed a test of its ability to detect blatant, violent hate speech. The nonprofit Global Witness submitted hateful ads focused on Ethiopia to see if the platform would catch them. It did not. https://t.co/6EP5Q2KM1k"
AP,"Two men are facing murder charges and have been arrested in Virginia in the death of two bystanders in last weekend's shooting in a busy entertainment district in Philadelphia, officials said. The men will be extradited to face charges in Philadelphia. https://t.co/GbZvlfg320"
AP,"The House Jan. 6 panel has interviewed more than 1,000 people who were directly or indirectly involved in the Capitol insurrection. A small group of those witnesses will return for a series of public hearings as the committee presents its findings. https://t.co/f9zuDiz0qY"
AP,"An investigation into Teslas that crashed into parked emergency vehicles has moved a step closer to a recall.

The probe cites reports of 16 crashes between Teslas using partially automated systems and emergency vehicles, causing 15 injuries and one death. https://t.co/cmW2FUMzni"
AP,"The Jan. 6, 2021, insurrection at the U.S. Capitol played out for the world to see, but the House committee investigating the attack believes a more chilling story has yet to be told. https://t.co/K9Hgz03z7t https://t.co/HD5mrNUDNb"
AP,"The House committee investigating the Jan. 6 attack on the U.S. Capitol will go public with its findings starting tonight.

Here’s a look at how to watch and what to expect.

https://t.co/bla141V22d"
AP,"The U.S. House has approved a “red flag” bill that would allow families, police and others to ask federal courts to order the removal of firearms from people believed to be at extreme risk of harming themselves or others. It’s unlikely to pass the Senate. https://t.co/iKFL8qf34w"
AP,"Iran has started removing 27 surveillance cameras installed by U.N. inspectors, widening a dispute over Tehran’s program as it enriches uranium closer than ever to weapons-grade levels. Here’s a timeline of the major events involving Iran’s atomic program. https://t.co/yY8DOFbkwX"
AP,"The average price that Americans pay for a gallon of gasoline is closing in on $5.

AAA said the nationwide average for regular gas on Thursday was $4.97, up a quarter in just the last week. https://t.co/xf1HrGu50L"
AP,"It's the inflation you’re not supposed to see.

Manufacturers worldwide are quietly shrinking package sizes without lowering prices. It’s dubbed “shrinkflation,” and it’s accelerating along with inflation. https://t.co/EMrzftZZw2 https://t.co/UFvwVaSZcG"
AP,"Virginia's General Assembly will not consider legislation this year intended to lure the Washington Commanders to the state. 

The Democratic Senate majority leader says there are too many issues to be resolved and controversies regarding the NFL team. https://t.co/vQxUllGctQ"
AP,"The result of the coming weeks of public hearings may not change hearts or minds in a politically polarized America. But the committee’s investigation with 1,000 interviews is intended to stand as a public record for history. https://t.co/bAL8qbC5gH"
AP,"With never-seen video, new audio and a “mountain of evidence,” the House Jan. 6 committee will attempt to show not only the deadly violence at the Capitol, but the backstory as the defeated president, Donald Trump, tried to overturn Joe Biden's election. https://t.co/RVgwR8oNa1"
AP,"Four Marines were killed and another is missing after an Osprey aircraft crashed in the Southern California desert, a military official said on Thursday — a day after the accident.

The investigation is still ongoing. No additional details were available. https://t.co/NcUjlaNMrH"
AP,"BREAKING: Ryan Kelley, a Republican candidate for Michigan governor, has been charged with a misdemeanor for his role in the 2021 riot at the U.S. Capitol.

Kelley was arrested in western Michigan and awaits a court hearing in Grand Rapids, FBI says. https://t.co/739ODzmlNX"
AP,"The U.S. Justice Department is opening an investigation into the Louisiana State Police amid mounting evidence that the agency has looked the other way in the face of beatings of mostly Black men, including the deadly 2019 arrest of Ronald Greene. https://t.co/GZXY1FRNoE"
AP,"It’s now legal to cultivate and possess marijuana in Thailand.

While the country still discourages smoking pot and getting high, advocates celebrated the government’s decision to remove it from the category of narcotic drugs. https://t.co/D7X9m0xMyF https://t.co/UA42MLjwfn"
AP,"Some U.S. troops with certain religious objections to COVID-19 vaccines could get a viable new option if Novavax shot gets approved by the FDA.

Here's a look at why the Novavax vaccine is more appealing to some. https://t.co/OAmk30mgyY"
AP,Thousands of coronavirus testing sites have popped up on sidewalks across Beijing and other Chinese cities in the latest development in the country’s “zero-COVID” strategy. Regular testing of residents is becoming the new normal. https://t.co/r4qGBRZhdp
AP,"More Americans applied for jobless aid last week but the total number of Americans collecting unemployment remains at a five-decade low. Applications for unemployment benefits rose by 27,000 to 229,000 for the week ending June 4, the Labor Department said. https://t.co/5YhZJNmutG"
AP,Russian forces pounded an eastern Ukrainian city and the two sides waged pitched street battles in Sievierodonetsk that President Volodymyr Zelenskyy said could determine the fate of the critical Donbas region. https://t.co/r0QN8HK7xH
AP,"The head of the U.N.'s nuclear watchdog agency said that Iran is removing 27 surveillance cameras from nuclear sites. Rafael Mariano Grossi, director-general of the International Atomic Energy Agency, said it poses a “serious challenge” to its efforts. https://t.co/l5kMPGm17v"
AP,State police officials say three people have been killed after at least a dozen vehicles collided in different spots along heavily-traveled Interstate 30 in southwestern Arkansas. https://t.co/llGfNAnCVw
AP,"""Russian soldiers drink vodka, we are making music."" 

A Ukrainian rapper and soldier gives voice to the hatred of Russia felt by young Ukrainians, now venting their fury in song, art, tattoos and fundraising for the war effort.

By @johnleicester in Kyiv: https://t.co/AXnDonYV9I https://t.co/vmLrMc0bq0"
AP,"Thailand legalizes the cultivation and possession of marijuana, like a dream come true for an aging generation of pot smokers who recall the legendary Thai Stick. The health minister says he will  distribute 1 million marijuana plants to get things going. https://t.co/fKHC9CKxOV"
AP,White House officials say millions of COVID-19 vaccine doses have been ordered for small children in anticipation of possible federal authorization next week. https://t.co/4kFHTVDWyc
AP,"A fire caused by suspected arson spread through an office building in South Korea’s Daegu city, killing at least seven people and injuring at least 41 people, local fire and police officials say. https://t.co/sI9VsEjtke"
AP,"Thousands of COVID-19 testing booths have popped up on sidewalks across China in the latest twist to the country's “zero-COVID” strategy. Major cities, like Beijing and Shanghai, must have testing stations within a 15-minute walk for all residents. https://t.co/X3xbyL8q4H"
AP,"Meet Otoy, a Ukrainian rapper and soldier fighting Russia with scorching lyrics from the battlefields and his AR-15 rifle. In song, art, tattoos and online, his post-independence generation is venting its fury at the war. https://t.co/hT7eCpcSqf https://t.co/JOXVVIVzkO"
AP,"Firefighters quickly put out a blaze on the second floor of a seven-floor office building in South Korea's Daegu city. Seven people died, including the unidentified man police suspect set the fire in a lawyer’s office. https://t.co/efcHl0QGZK"
AP,"It's now legal to cultivate and possess marijuana in Thailand, but the country still discourages smoking pot and getting high. It's promoting cannabis for medical use only, high THC products are still illegal and public smoking might mean jail and fines. https://t.co/LfF79qLwSD"
AP,New COVID-19 vaccine under review could give U.S. military a way to get shots into some of the thousands of service members who have refused the vaccine for religious reasons. https://t.co/zMxmPKuvol
AP,"Prosecutors say R. Kelly, the R&amp;B superstar known for his anthem “I Believe I Can Fly,” deserves at least 25 years behind bars for sexually abusing women and girls. They demanded the sentence in advance of his sentencing later this month. https://t.co/CK5KXKVWm7"
AP,"BREAKING: Fire officials say dozens of firefighters have been deployed to fight a blaze in an office building in Daegu, South Korea. Seven deaths have been confirmed and 35 people have been injured. https://t.co/FG1OVLoXRI"
AP,"President Biden, welcoming leaders to the Summit of the Americas, says democracy is an “essential ingredient” for the Western Hemisphere’s future. Some heads of state had boycotted the gathering because authoritarians were not invited. https://t.co/lYTXspoT4I"
AP,"This tweet has been re-sent to correct the spelling of ''Republic."" https://t.co/uE7nzHm2vI"
AP,Judicial documents obtained by @AP reveal a possible motive in this week's fatal shooting of a government minister in the Dominican Republic. The papers say the suspect had been denied environmental permits for various business projects. https://t.co/Pv7QHJV0zj
AP,"California is a Democratic fortress, but Tuesday’s primary election may have revealed some cracks. Here are takeaways from the vote in the nation’s most populous state. https://t.co/TsEyHoU4wu"
AP,The Interior Department says it will phase out sales of plastic water bottles and other single-use products at national parks and on other public lands over the next decade. The order essentially reverses a 2017 Trump administration policy. https://t.co/0TT0QkU7AP
AP,"Blistering heat is in store for the southwestern U.S. the next several days, with temperatures in spots expected to top 110 degrees. Officials are advising people to limit time outdoors, drink plenty of water and seek shade if they must be outside. https://t.co/fkvjZgJOzW"
AP,Video testimony played for jurors at a civil trial shows Bill Cosby denying sexually abusing a teenage girl at the Playboy Mansion in the mid-1970s. It's the first time Cosby's voice has been heard in the six days of the trial. https://t.co/LWpiEyGSj6
AP,"A former Maryland man held at the Guantanamo Bay detention center has languished in custody months after his scheduled release date, according to a federal lawsuit. https://t.co/owIJ156aS0"
AP,"Russian authorities are continuing their crackdown against citizens who speak out about the fighting in Ukraine. The repressive atmosphere prompted Moscow’s chief rabbi, who has refused to publicly back the war, to flee the country. https://t.co/ZbZ7ibq90F"
AP,The political world is taking note of the ouster in a recall election in California of a progressive district attorney seen as soft on crime. President Biden says voters sent a “clear message” to both parties about public safety. https://t.co/NOQBvAKvgg
AP,Hawaii photographer Clark Little is known for his stunning images from inside some of the most powerful and dangerous waves on Earth. The Oahu native just released a new book that chronicles years of capturing the beauty of the ocean. https://t.co/GUrLklgxPz https://t.co/PZrVfj9wnN
AP,"TV viewers will find nearly blanket prime-time coverage of a Congressional hearing Thursday on the Jan. 6 Capitol riot. That's with the exception of Fox News Channel. It says it will carry the hearing as ""news warrants."" https://t.co/MsEeduXrDK"
AP,"Ex-President Donald Trump, Donald Trump Jr. and Ivanka Trump have agreed to answer questions under oath in the New York attorney general’s civil investigation into his business practices. Trump has decried the probe as a politically motivated “witch hunt.” https://t.co/EqKW9Z4vY8"
AP,"The Justice Department has named a team of nine people, including an FBI official and former police chiefs, to aid in a review of the law enforcement response to the Uvalde, Texas, elementary school shooting. https://t.co/l3DS1GVvS8 https://t.co/VRGSkXaBUp"
AP,"The U.S. House has voted to set a minimum age of 21 for buying semi-automatic weapons in response to recent mass shootings in Buffalo, New York, and Uvalde, Texas. The measure is almost certain to fail in the Senate. https://t.co/gaqFx0E9E9"
AP,"Dr. Mehmet Oz, the celebrity heart surgeon endorsed by former President Donald Trump, won Pennsylvania's Republican U.S. Senate primary on Wednesday, narrowly defeating former hedge fund CEO David McCormick after a dayslong recount.  https://t.co/09XPN4TuC6"
AP,"Mexican megachurch leader Naasón Joaquín García has been sentenced to 16 years and eight months in a California prison for sexually abusing three girls.

He was sentenced after pleading guilty to three felonies on the eve of a long-awaited trial. https://t.co/WKwUbBDS9K"
AP,"The House is moving quickly to pass legislation in response to recent mass shootings in New York and Texas.

The legislation has almost no chance of becoming law, but it will allow Democrats a chance to show voters where they stand on the issue. https://t.co/o9L8MgOvaH"
AP,"The Biden administration is undergoing a period of unusually high staff turnover as President Biden nears 18 months in office.

Low morale and relatively low pay are taking a toll on both the ranks of the senior staff and junior aides alike. https://t.co/kioiXjaARW"
AP,"Follow @AP for live coverage and takeaways from the hearings.

https://t.co/aYbKTBmvrk"
AP,"Dozens of the insurrectionists have been brought to justice, many of them being convicted or pleading guilty to serious crimes. 

But the committee’s goal is larger: Who in a position of power should also be held to account? 

https://t.co/Ly0oEqxb2z"
AP,"The hearing is expected to be a broad, multimedia overview of the committee’s findings — more than 1,000 people have been interviewed by the panel — as well as a reminder to the public of the violence of the day. 

https://t.co/0bBBCOUWZt"
AP,The committee is setting out to establish the historical record of an event damaging not only to a community or individual families but to the collective idea of democracy itself. https://t.co/awabS9RznM
AP,"With personal accounts and gruesome videos, the committee expects Thursday’s primetime hearing to begin to show that America’s tradition of a peaceful transfer of presidential power came close to slipping away. 

https://t.co/bla141DraF"
AP,"The Jan. 6, 2021, insurrection at the U.S. Capitol played out for the world to see, but the House committee investigating the attack believes a more chilling story has yet to be told. 

https://t.co/AKs0tvoYoe"
AP,"Twitter plans to offer Elon Musk access to its “firehose” of raw data on hundreds of millions of daily tweets in an effort to push forward the billionaire’s agreed-to $44 billion acquisition of the social media platform, according to multiple news reports. https://t.co/X6MhOPHbDo"
AP,This tweet replaces an earlier post that misspelled Miguel Cerrillo's last name.
