handle,text
AP,"After the arrest of over two dozen members of a white supremacist group near a northern Idaho pride event, including one identified as its founder, LGBTQ advocates say polarization and political upheaval are putting their community increasingly at risk. https://t.co/O3SZisAjGX"
AP,"After experiencing global warming's firsthand effects, U.S. Latinos are leading the way in activism around climate change, often drawing on traditions from their ancestral homelands.

https://t.co/ijw0lqyJaR"
AP,@AP Allen's announcement came less than a week after @AP was first to report on new court filings that showed the FBI had seized his electronic data as part of the lobbying probe. https://t.co/B43mrSYYUH
AP,"BREAKING: Retired U.S. Marine Corps Gen. John Allen, president of the Brookings Institution, has resigned amid a federal investigation into whether he illegally lobbied on behalf of the wealthy Persian Gulf nation of Qatar. https://t.co/nRTcEXCDq2"
AP,"BREAKING: Former President Trump's campaign manager, Bill Stepien, is among the witnesses scheduled to testify Monday at a hearing of the House committee investigating the Jan. 6 U.S. Capitol insurrection, the panel announced. https://t.co/GWfzHfzTQL"
AP,"Read more on the Latino activists who are now sounding the alarm about the risks for global warming for their neighborhoods and the world.

https://t.co/XgdJGy3V7B"
AP,"Hispanics are also disproportionately affected by chronic health conditions aggravated by extreme heat, like diabetes and heart and kidney disease.

https://t.co/dR0jCbHsnh"
AP,"U.S. Latinos often live in ignored, lower income neighborhoods that are degrees hotter than nearby areas because they have a higher population density and limited tree canopy. 

https://t.co/oLFtGtb80v"
AP,"After experiencing global warming's firsthand effects, U.S. Latinos are leading the way in activism around climate change, often drawing on traditions from their ancestral homelands.

https://t.co/pCDVwwGaRs"
AP,"Projections from first round of French parliamentary election suggest President Emmanuel Macron has protected his centrist majority from a leftist coalition.

https://t.co/9cVw4AUF0H"
AP,"NATO's secretary-general says Turkey has “legitimate concerns” over terrorism.

Turkey has accused Finland and Sweden of supporting Kurdish militants and says it will not back the two Nordic nations joining NATO until they change their policies.

https://t.co/xjfNtVMXq2"
AP,"A midwifery clinic owner wants to open Mississippi's first birth center. She and other advocates say that amid the abortion debate, nothing is being done to support women, particularly Black moms, in the state with the highest infant death rate. https://t.co/biqBV4Rdwv"
AP,French voters are choosing lawmakers in a parliamentary election as President Emmanuel Macron seeks to secure his centrist majority. His party is facing competition from a newly formed leftist coalition. https://t.co/Imqeo5Mpqn
AP,"The proposal falls far short of tougher steps long sought by President Joe Biden and many Democrats. Still, if the accord produces a law, it would signal a turn from years of gun massacres that have yielded little but stalemate in Congress. https://t.co/f5XFx2GSGA"
AP,"The framework would also bolster school safety and mental health programs. Other steps include requiring more people who sell guns to obtain federal dealers' licenses, so they would have to conduct background checks of purchasers. https://t.co/hyxHH27xYP"
AP,The compromise would make juvenile records of gun buyers under age 21 available when they undergo background checks. And it would offer states money to implement “red flag” laws making it easier to temporarily take guns from potentially violent people. https://t.co/fD68Bc0mby
AP,Spain wilts under its first major heat wave of the year. Temperatures are expected to hit 109 degrees F (43 Celsius) in the south. https://t.co/LvnYOZwkHL
AP,"BREAKING: Senate bargainers announced a bipartisan framework responding to last month’s mass shootings, a modest breakthrough offering measured gun curbs and bolstered efforts to improve school safety and mental health programs.

https://t.co/RPI1Ge92We"
AP,"The Massachusetts Bay Transportation Authority is going to tackle the nuisance of public urination with technology. The MBTA is launching a pilot program this summer in which urine detection sensors will be placed in four downtown elevators.

https://t.co/S5UuJWm1vs"
AP,"A police investigation into the disappearance of a British journalist and an Indigenous official in the Amazon points to an international network that pays poor fishermen to fish illegally in Brazil’s second-largest Indigenous territory, authorities said.

https://t.co/yBysNdzyEp"
AP,"As many as 10 million children in the U.S. may help care for family members who are sick or have serious health problems. 

Researchers expect that more people will depend on children as the population ages. https://t.co/Zg3VkGMILY https://t.co/b6Jpfryeqc"
AP,"As the number of people sentenced for crimes in the Capitol riot nears 200, an @AP analysis shows that some judges are divided over how to punish the rioters.

A former public defender has consistently taken the hardest line against Jan. 6 defendants.

https://t.co/VCaHTp6okS"
AP,"Recent weeks have seen an especially intense set of revelations about sexual assault in churches across the U.S. Survivors say it is further confirmation of their years of whistleblowing.

https://t.co/1ncjQUPPBE"
AP,"Authorities arrested 31 members of the white supremacist group Patriot Front near an Idaho pride event after they were found packed into the back of a U-Haul truck with riot gear.

“They came to riot downtown,” the Coeur d’Alene police chief said.

https://t.co/mviB2sf7GJ"
AP,"Former Alaska Gov. Sarah Palin leads in early results from Saturday's special primary for the state's U.S. House seat. 

The top four vote-getters among 48 candidates seeking to replace late U.S. Rep. Don Young will advance to an August special election.

https://t.co/O17XcZHWMz"
AP,"Chinese authorities have arrested nine people on suspicion of violently assaulting several women at a restaurant after surveillance footage of the attack sparked widespread outrage.

https://t.co/88tnMB7Wwv"
AP,"A 15-year-old boy is being hailed in Ukraine for aerial reconnaissance work he did with his father when Russia invaded. 

The father-son team used their drone to help the military spot, locate and destroy Russian targets in the early days of the war.

https://t.co/1l0MUaDYqY"
AP,"Ukrainian President Volodymyr Zelenskyy says no one knows how long the war in his country will last but that Ukrainian forces are defying expectations by preventing Russian troops from overrunning eastern Ukraine.

https://t.co/rR5Z1qWcer"
AP,BREAKING: Two-time defending NHL champion Tampa Bay Lightning beat the New York Rangers 2-1 in Game 6 to set up Stanley Cup final against the Colorado Avalanche. https://t.co/t1KsJAAWMv
AP,"BREAKING: In an @AP interview, Sri Lanka's prime minister says the island nation is desperate for fuel and hopes to acquire more from the Mideast. If that doesn't work, though, he says he's open to buying it from Russia. https://t.co/95UBWnhCUF"
AP,"Phoenix hit 114 degrees, tying a century-old record, while Las Vegas, Denver and California's Death Valley also posted record temperatures as dangerous heat swept across the American Southwest. https://t.co/C4ttHqRZl4"
AP,"""It appears these people did not come here to engage in peaceful events."" Authorities arrested 31 members of the white supremacist group Patriot Front near an Idaho pride event after they were found packed into the back of a U-Haul truck with riot gear. https://t.co/XXbiCN3rbj"
AP,"In Santa Fe, President Joe Biden said he is escalating federal assistance for New Mexico, now facing its largest wildfire in state history. The fire began with U.S. Forest Service prescribed burns that spread out of control, destroying hundreds of homes. https://t.co/Hp2ZWlSGTR"
AP,A suburban Seattle city will pay more than $1.5 million to settle a dispute with a former assistant police chief who was disciplined for posting a Nazi rank insignia on his office door and joking about the Holocaust. https://t.co/Bx5tAkODow
AP,"BREAKING: Mo Donegal has finished first at the Belmont Stakes, with Nest in second, giving trainer Todd Pletcher a 1-2 finish for his sixth victory in the Triple Crown race. https://t.co/vXSOOGD7ZZ"
AP,"@AP A slate of 48 candidates, including former Gov. Sarah Palin and a man whose legal name is Santa Claus, are all vying for the House seat, left vacant by the death of GOP Rep. Don Young in March. https://t.co/zlDlyENZBi"
AP,@AP The Alaska Supreme Court has reversed and vacated a lower court order that barred state elections officials from certifying the results of the election until visually impaired voters were given a “full and fair” opportunity to participate. https://t.co/lWxDaxj5rV
AP,The special primary for Alaska's only U.S. House seat is moving forward as planned following a tense legal fight over ballot access issues that had cast a shadow over the election. https://t.co/DZgXPN3p3p
AP,"""He was my hero and the best man I know."" Former LA Dodgers player Steve Sax has issued a statement saying that his son, Capt. John J. Sax, was among five U.S. Marines killed in an Osprey training flight crash earlier this week in the California desert. https://t.co/7ofjaSApOf"
AP,Oklahoma's attorney general has asked the state's highest appeals court to set execution dates for 25 death row inmates following a federal judge's rejection of the inmates' challenge to the state’s lethal injection method. https://t.co/Mu1ZRJfnhk
AP,"Average U.S. gas prices hit a record $5 a gallon on Saturday, and there is little evidence they will drop anytime soon.

Why is it happening? Everyone seems to have a favorite villain. But several factors are coming together to push prices higher.

https://t.co/spg8R5oVv5"
AP,"The United Nations mission to Libya has expressed concern over clashes in Tripoli, after a night of heavy fire between militias. The latest fighting comes as Libya is once again divided between competing governments — one of which is based in Tripoli. 

https://t.co/YP6xbk2IiL"
AP,"Thousands of people are rallying on the National Mall and across America in a renewed push for gun control measures after recent deadly mass shootings.

Activists say what happened in Uvalde, Texas, and Buffalo, New York, should compel Congress to act.

https://t.co/Q6haRPcCsL"
AP,"A woman who accused her therapist of sexual assault felt shocked and betrayed when she dug deeper and found he not only once killed a girl while driving drunk, but also was allowed to forge a new life and career under a different name.

https://t.co/e0f6d2Xvgm"
AP,"A disciplinary branch of the District of Columbia Bar says former New York Mayor Rudy Giuliani must answer to professional ethics charges for his role in former President Donald Trump's efforts to overturn the results of the 2020 presidential election.

https://t.co/cfPzJl2g72"
AP,"A judge in Las Vegas has thrown out a lawsuit against soccer star Cristiano Ronaldo filed by a woman who claimed he raped her in Las Vegas in 2009. The judge said ""bad-faith conduct"" by the woman's attorney tainted the case beyond redemption.

https://t.co/XngIOgMcOR"
AP,"Several of the Republicans seeking to become the top elections official in Nevada have cast doubt on the integrity of elections, despite no evidence of widespread fraud or manipulation in the 2020 presidential election, @AP_Christina and @ssonner write.

https://t.co/eGGHpIbENj"
AP,"Millions of Americans with serious health problems depend on children to provide some form of care at home.

For the Kotiya brothers, balancing caregiving with being a kid is part of their daily routine. https://t.co/Zg3VkH4kay https://t.co/PbniUkw8n4"
AP,"Justin Bieber says Ramsay Hunt syndrome has paralyzed half of the superstar performer’s face and is the reason behind his tour postponement. The syndrome causes facial paralysis and affects nerves in the face through a shingles outbreak.

https://t.co/HYGpQklmae"
AP,This replaces an earlier tweet that linked to the wrong story.
AP,"The U.S. Census Bureau is requesting millions of dollars to study how best to ask questions about sexual orientation and gender identity. The goal is to provide better information about the LGBTQ population nationwide.

https://t.co/CEaGQoFbJ8"
AP,"A drunken driver who killed a girl, changed his name in prison and became a therapist is now accused of sexually assaulting a client.

The case raises questions about life after incarceration and what patients should know about a provider’s past.

https://t.co/M5lbEnJRHc"
AP,"Stephen Curry scored 43 points to lead the Golden State Warriors to a 107-97 victory over the Boston Celtics in Game 4 of the NBA Finals. The series returns to San Francisco knotted at two games apiece.

https://t.co/UfpLN5wHne"
AP,"A federal judge has found that a Georgia sheriff’s office was illegally discriminating when it denied gender reassignment surgery to a deputy. The judge says Houston County cannot exclude surgery for the transgender woman from its health insurance plan.

https://t.co/Sx0yLfEf7f"
AP,"War, guilt and last kisses: The summer of 2022 is proving bitter and conflicted for Ukraine’s capital, where the relative calm is tempered by acute worry for soldiers dying on the battlefields. 

@johnleicester captures the mood from Kyiv. https://t.co/L66jwC6Q5S https://t.co/eqCilQOQcs"
AP,"A New York philanthropy is apologizing for its role in the Tuskegee syphilis study, in which the government purposely let hundreds of Black men die of the disease. The Milbank Memorial Fund paid funeral expenses, but only if loved ones allowed autopsies.

https://t.co/BTzRr9cDqW"
AP,Venezuela’s President Nicolas Maduro on his first visit to Iran says the Islamic Republic helped his nation by sending badly needed fuel despite U.S. sanctions and threats. https://t.co/Syi4L7bQ8F
AP,"U.S. Secretary of Defense Lloyd Austin has stressed American support for Taiwan, suggesting at Asia’s premier defense forum that recent Chinese military activity around the self-governing island threatens to change the status quo. https://t.co/UJx8EykNWS"
AP,"BREAKING: The nationwide average price for a gallon of gasoline has topped $5 for the first time ever, auto club AAA says. Motorists in some parts of the country, especially California, are paying far above that. https://t.co/sHkt0xLNyf"
AP,"Former Bolivian interim President Jeanine Áñez has been sentenced to 10 years in prison on charges linked to her assumption of office in 2019 amid violent protests that led to the resignation and exile of her predecessor, Evo Morales. https://t.co/mtZVDvTlY0"
AP,North Korean leader Kim Jong Un doubled down on his arms buildup in the face of what he described as an aggravating security environment as he concluded a major political conference. https://t.co/plJKgaifsG
AP,"A survivor of a brutal South Korean facility where thousands were enslaved and viciously abused in the 1980s, Joo-Rei Mathieson is now on a mission to discover her biological roots decades after she was adopted to Canadian parents.
https://t.co/MDdvrsT36s"
AP,"AP Photos: In the midst of war, life goes on in Ukraine. @AP_Images https://t.co/S4z0VDyobG"
AP,"The New York attorney general's lawsuit against the NRA is no mere “witch hunt,” a New York judge has ruled in dismissing the gun rights advocacy group's claims that the case is a vendetta. The decision means the nearly 2-year-long legal fight can proceed. https://t.co/46qcZkSVG2"
AP,"Justin Bieber says a rare disorder that paralyzed half his face is the reason behind his tour postponement. The multi-Grammy winner said he is suffering from Ramsay Hunt syndrome, which affects nerves in the face through a shingles outbreak. 
https://t.co/WzBsJACKky"
AP,A historical marker honoring gay rights pioneer Richard Schlegel was removed after a Pennsylvania state senator raised concerns over a 1993 interview where Schlegel recounts an early sexual encounter with a younger boy. https://t.co/0AajAYFGAS
AP,"About 20 million people watched the opening night of hearings of the House panel investigating the Jan. 6 U.S. Capitol insurrection, according to Nielsen. By comparison, the opening day of each of the Trump impeachment trials drew about 11 million viewers. https://t.co/4vgOG8Eb6n"
AP,"The centerpiece of the opening hearing on the House panel's Jan. 6 investigation was a video reconstruction of the Capitol attack. Point by point, it showed the mob storming the building to stop certification of Joe Biden's election win over Donald Trump. https://t.co/PsbquZdcOx"
AP,This thread was re-posted to remove a headline from an image that was not clear.
AP,"After Teodora del Carmen Vásquez lost her nearly full-term fetus,  she was prosecuted, convicted and given 30 years in prison for aggravated homicide.

Vásquez was freed in 2018 after her sentence was commuted. https://t.co/HOuQKPeXVd https://t.co/sCFWG3uCzI"
AP,"Prosecution and punishment overwhelmingly fall on poor, young women who lack sufficient access to medical services and cannot afford to travel overseas for an abortion or pay for good legal defense if they run afoul of the law. https://t.co/kglA4TgZ4o"
AP,"With Roe v. Wade in jeopardy in the United States, activists say El Salvador’s law should serve as a cautionary tale. https://t.co/KtwDhRqoFn"
AP,"El Salvador has one of the world’s strictest abortion laws.

Abortion rights activists say it has led to widespread human rights violations against Salvadoran women. https://t.co/HOuQKPeXVd https://t.co/luIfwaiVG3"
AP,"Family members of the sole person arrested in the disappearance of a British journalist and Indigenous official in the Amazon are saying that that he is innocent, and allege that Brazilian authorities have been abusive and are trying to force a confession. https://t.co/LLoUi8TT5r"
AP,"The second March For Our Lives rally will take place Saturday in Washington, D.C.

With recent shootings in Texas and New York, tens of thousands of people are expected at rallies around the U.S. this weekend demanding meaningful changes to gun laws. https://t.co/E2kTly9FI5"
AP,"BREAKING: Wall Street stocks sank after inflation hit a 40-year high. The S&amp;P 500 dropped 2.9%, closing out its ninth losing week in the last 10. https://t.co/SvAHCdxlt6"
AP,"BREAKING: A Texas judge has temporarily blocked the state from investigating families of transgender children who have received gender confirming medical care.

The order provides a new obstacle to the state labeling such treatments as child abuse https://t.co/Zm0mn5i0fe"
AP,"The U.S. government is building up its supply of monkeypox vaccine to contend with escalating cases.

Officials say the risk to the American public is low, but they are taking steps to assure measures are in place to deal with the growing problem. https://t.co/iQy1UM0YNj"
AP,"When the Jan. 6 House panel resumes on Monday, it will outline how then-President Donald Trump knew early on that he had lost the election but engaged “in a massive effort to spread false and fraudulent information” to convince the public otherwise. https://t.co/0STIkKCo2T"
AP,"President Joe Biden's administration has scrapped former President Donald Trump's red, white and blue design for the new generation of Air Force One after a review suggested it would raise costs and delay the delivery of the new jets. https://t.co/tj6CPda679"
AP,"El Salvador has one of the world’s strictest abortion laws, banning the procedure in all circumstances.

Activists and previously imprisoned women say the country is a cautionary tale for what could happen in the U.S. if Roe v. Wade is overturned. https://t.co/4rAmI3gNML https://t.co/rIaBYHEBP4"
AP,"A judge has set the bond at $100,000 for Christopher Schurr, the Michigan police officer charged with second-degree murder in the shooting of Patrick Lyoya. https://t.co/JVc0d5J7MT"
AP,"Fury over the Supreme Court's likely rollback of federal abortion protections prompted some to drop cash on groups that help people access the procedure.

The ""rage giving"" helps, those groups say, but could have come sooner. https://t.co/IHUlSGai1S"
AP,"Small businesses that depend on tourism are hoping for a booming summer. But higher costs, a worker shortage and the lingering threat of COVID may put a damper on those hopes. https://t.co/ydnS40DTNa"
AP,"Big-money political donors from across the country have been pouring money into local races for prosecutors.
Left-leaning groups see winning the offices in places as a path to implementing criminal justice reforms. https://t.co/kscPWvq1nn"
AP,"Stocks tumbled after data showing inflation is getting worse, not better. The S&amp;P 500 was 2% lower in the first half hour of trading, while moves in the bond market indicated investors’ concerns about a possible recession. https://t.co/MWeCD6sQEn"
AP,"Between 100 and 200 Ukrainian soldiers are being killed every day in Russia’s military onslaught, an adviser to Ukraine’s president says. Mykhailo Podolyak says only more and more advanced Western weaponry will turn back the Russian offensive. https://t.co/rZxyQmOHCY"
AP,"""I want the American public to remember that despite the fact that we were on the floor, fearing for our lives, that we went back and we certified that election.""

Rep. Pramila Jayapal reflected on the events of Jan. 6 after the first of several hearings investigating the attack. https://t.co/vbUSE7BnXu"
AP,"BREAKING: The Biden administration is lifting its requirement that international air travelers to the U.S. take a COVID-19 test within a day before boarding their flights, a senior administration official says. The mandate will expire on Sunday. https://t.co/xi5LTyIaSM"
AP,"Rep. Liz Cheney, the panel’s vice chair, spoke directly to her GOP colleagues during the hearing on the Jan. 6 attack: ""I say this to my Republican colleagues who are defending the indefensible: There will come a day when Donald Trump is gone, but your dishonor will remain."" https://t.co/cbiyvT7QMy"
AP,"Rep. Bennie Thompson, chairman of the House committee investigating the Capitol insurrection, opened Thursday’s hearing, saying: “Jan. 6 was the culmination of an attempted coup.”

Thompson warned that democracy ""remains in danger"" from a ""conspiracy"" that fueled the riot. https://t.co/vVH72OSS4A"
AP,"Inflation hit a new four-decade high, giving American households no respite from rising costs.

Consumer prices surged 8.6% last month from 12 months earlier, the Labor Department said. https://t.co/1ygFq5ibSn https://t.co/QDJKHHqmx4"
AP,"""It was carnage. It was chaos. ... Never in my wildest dreams did I think that as a police officer, as a law enforcement officer, I would find myself in the middle of a battle.""

U.S. Capitol Police Officer Caroline Edwards describes ""absolute war zone"" outside of the Capitol. https://t.co/3mF0O6G8oV"
AP,A public spending watchdog is unimpressed with Britain's plan for billions worth of personal protective equipment that must be dumped because it is defective or does not meet standards. The government wants to burn the material to generate power. https://t.co/C1rPvOlCUr
AP,"House investigators worked to lay out an exhaustive case in the first hearing examining the Jan. 6, 2021, insurrection.

The committee is trying to tell the story of how it happened, and how to prevent it from ever happening again, for history. https://t.co/yLshjfpUrb"
AP,"U.S. Capitol Police officer Harry Dunn said Thursday night's Jan. 6 hearing confirmed his suspicions about that day.

""It's no longer my opinion to say that Donald Trump did not help us. It's no longer my opinion. It's a fact,"" Dunn said to reporters after the hearing. https://t.co/NvKa5sbjO7"
AP,Pope Francis has canceled his planned July trip to Congo and South Sudan on doctors' orders because of knee problems. Francis has been using a wheelchair due to strained ligaments in his right knee that have made walking and standing difficult. https://t.co/nl00KW0Ydr
AP,White nationalists and supremacists on social media platforms are using coded hashtags and innuendo to rile up thousands of followers on divisive issues that federal officials warn might drive some extremists to violently attack public places in the U.S. https://t.co/OIgeHuloPr
AP,"Volunteer drivers are risking everything to deliver humanitarian aid to Ukrainians behind the front lines of the war — and to help many of them escape. The routes are dangerous and long and the drivers risk detention, injury or death. https://t.co/l2wyPeFKH5"
AP,"Australia’s prime minister says after a meeting with his New Zealand counterpart that the two nations are in lockstep in their policies toward the Pacific islands, where China's influence is growing. https://t.co/pJ7rGPZCyV"
AP,"As Russia’s invasion of Ukraine grinds into its fourth month, officials in Kyiv have expressed fears that the specter of “war fatigue” could erode the West’s resolve to help the country push back Moscow’s aggression following unprecedented unity. https://t.co/h4nilwcdFi"
AP,"Japan has partially opened its borders to foreign tourists and began accepting applications, but only for those on guided package tours who are willing to follow mask-wearing and other antivirus measures. https://t.co/TmEHOtU7NX"
AP,Capitol Police Officer Caroline Edwards described to lawmakers on the House committee investigating the Jan. 6 insurrection what she could only describe as the “war scene” that she and other officers faced when rioters began viciously attacking them. https://t.co/ukWAELayAM
