handle,text
guardian,Republic of Ireland v Scotland: Nations League – live! https://t.co/wpD4wIUae4
guardian,Frontline workers: how has the cost of living crisis affected your work? https://t.co/DNeCfLJvjy
guardian,"With six weeks to save summer, can easyJet climb out of the chaos? https://t.co/KcUbicSeVz"
guardian,"Sanctions are hitting hard enough to hurt Russia, if not stop it https://t.co/ZQrGCLkbGn"
guardian,Octopus Energy’s Greg Jackson: ‘Climate change is no longer this vague thing’ https://t.co/fgSgJcEeQy
guardian,"Leaked food strategy for English schools is paltry, experts say https://t.co/1vRRKIym2J"
guardian,Peruvian shamans perform ritual to help team reach World Cup finals – video https://t.co/BKaTKq7Qhc
guardian,Freddie Mercury’s ‘priceless’ stamp collection to be celebrated https://t.co/nkE3emphHI
guardian,Barristers to be balloted on possible walk-outs in row over legal aid rates https://t.co/dzf7eYMbMb
guardian,Melvyn Bragg: ‘My daughter conducted my marriage service’ https://t.co/ZeIRe2LcNe
guardian,Family of UK man sentenced to death by Russia call for cooperation https://t.co/6JeGotOky5
guardian,One to watch: Horsegirl https://t.co/8ECetcDumk
guardian,Liverpool agree €100m deal to sign Darwin Núñez from Benfica https://t.co/uZ7wD2WngP
guardian,"Dom Phillips: selfless, stylish writer at home in rave culture and the Amazon https://t.co/FM8y2Ou6Md"
guardian,Record UK petrol price risks a mass exodus of essential workers https://t.co/palLJBBY3W
guardian,"A 1,200-mile road-trip and no baby formula to be found. This is a nightmare | Anna Gazmarian https://t.co/Zv0NzN5Od6"
guardian,"Blacklist Dubai over failure to crack down on Russian oligarchs, say campaigners https://t.co/SJIbNm6fts"
guardian,Billie Eilish review – louder than ever https://t.co/xgooJLahpv
guardian,Ivanka turns on daddy but she’s just a Trump looking out for No 1 as usual | Arwa Mahdawi https://t.co/ERFnzEmbwX
guardian,Real Madrid wrap up €100m Aurélien Tchouaméni signing on six-year deal https://t.co/hOGjyFqg6R
guardian,"Shazia Mirza: ‘When I was eight, my mother said, “You are ugly, and ugly girls can’t become actresses”’ https://t.co/nTzS0dMgcn"
guardian,"Forget the thrill of the chase, only rarely do football’s biggest signings work out | Jonathan Wilson https://t.co/HtpWk0K5So"
guardian,‘I’m not afraid of clowns’: Republican defends vote to impeach Trump https://t.co/HBWCUeCkTh
guardian,"Fine airlines that break UK compensation rules, demand passengers https://t.co/NiaKRtNTeP"
guardian,Nottinghamshire pub co-owned by cricketer Stuart Broad closed after fire destroys roof https://t.co/mjvZo1PwCC
guardian,Tell us: are you holidaying in the UK this summer?  https://t.co/tWHHe0VngC
guardian,What links Eleanor Roosevelt and The Simpsons to James Callaghan’s daughter? https://t.co/iLVi8Ki41y
guardian,Blind date: ‘It felt more like a lunch break with a colleague’ https://t.co/cVpVmHlsvf
guardian,"Volodymyr Zelenskiy ‘didn’t want to hear’ warnings of Russia invasion, says Joe Biden https://t.co/lX4DOZcvah"
guardian,Have your photos published in the Guardian’s letters pages https://t.co/ll3443nPhy
guardian,"Paapa Essiedu on grief, doubt and fury at Boris Johnson: ‘Bigotry is the backbone of his character’ https://t.co/Sqsgsthv20"
guardian,Tell us: have you been affected by the UK monkeypox outbreak? https://t.co/KfyCksea5j
guardian,Does anyone ever really feel ‘grown up’? I asked some older people to find out https://t.co/9oJDpm7GAa
guardian,Orgasm gap: how Hollywood and science neglected female pleasure https://t.co/4qc3vUHl6k
guardian,March for Our Lives: thousands expected at US gun control protests https://t.co/dBdGlERxXN
guardian,Blackpool council leader criticises Tory minister’s ‘ignorant’ comments https://t.co/u16zojTT4Y
guardian,What cost of living crisis? Bumper executive bonuses make a comeback https://t.co/ptZP151Qag
guardian,Tell us: are you holidaying in the UK this summer?  https://t.co/tWHHe0DMp4
guardian,Tell us: have you been affected by the UK monkeypox outbreak? https://t.co/KfyCkrWzdL
guardian,Tell us: share your views on the right to buy for housing association tenants https://t.co/bC6GBDfS55
guardian,"In this week's #ComfortEatingPod, host @gracedent, and her guest @ItsBigZuu discuss what food is worth leaving the @BAFTA after party for.

Listen wherever you get your podcasts 🎧 

https://t.co/IZfortIaMI https://t.co/8FQ8XhDxvA"
guardian,"NHS needs reform not more money to deliver, Sajid Javid says https://t.co/ndLvS9Lupt"
guardian,"Student loan interest rate to be capped at 7.3% in autumn, says DfE https://t.co/XLlA0ZTeQA"
guardian,Meera Sodha’s vegan recipe for broken pasta with broad beans and rocket | The new vegan https://t.co/1BTOw9UefJ
guardian,Animal magic: why intelligence isn’t just for humans https://t.co/a8ZP0aTMB1
guardian,"England v New Zealand: second Test, day two – live! https://t.co/FMPn3L5P1Y"
guardian,Justin Bieber cancels shows after half of face left paralysed by virus – video https://t.co/aGV6vvp8lv
guardian,‘This team fills me with pride’: Wales fans on qualifying for the World Cup https://t.co/2lm1gKQIqh
guardian,‘It isn’t about politics – it’s about money’: will Hollywood take Johnny Depp back? https://t.co/8qjhEpdTHM
guardian,"Tim Dowling: a couple of glasses of red down, and it’s alarming how charming I feel https://t.co/APBDXKO22l"
guardian,Tell us: how have you been affected by rising petrol prices? https://t.co/eadkzjROHA
guardian,A living room on a skateboard: how electric vehicles are redefining the car https://t.co/plrjMPGIdy
guardian,"🚨 Football Weekly live tour special guests!

To find out who will be joining @maxrushden and @bglendenning in your city and to book your tickets now head to ⬇️ 

https://t.co/23iqIYPitA https://t.co/BeklgQoRFi"
guardian,I’m trying to make your life easier here: Sherwood is your next must-watch show https://t.co/6jVuJrnepf
guardian,‘I’m 80 and I’ve got more energy than most people’: the Arizona cheerleader squad for retirees – in pictures https://t.co/JHTmwq1FbN
guardian,TV tonight: who’s the most evil person in soaps? https://t.co/Cfr4jPOyCD
guardian,"Pomp and politics: Inside this week's @GuardianWeekly

Royal celebrations and a great escape.

Subscribe today: https://t.co/4NLrglKGks https://t.co/nbEUor7x1S"
guardian,"In their naked self-interest, LIV golfers are being refreshingly true to the sport’s roots | Barney Ronay https://t.co/DolQBD17Sy"
guardian,From Jurassic World Dominion to BTS – a complete guide to this week’s entertainment https://t.co/ZiaTjf0Gb8
guardian,Disability football cup final weekend to showcase sport and break barriers https://t.co/JqiuV4Lnfy
guardian,Not full of confidence: Labour frets over Starmer’s response to Tory chaos https://t.co/WffirlXtJN
guardian,"Climate crisis is ‘battering our economy’ and driving inflation, new book says https://t.co/L9dRRrYvLm"
guardian,Broad bean salad and nettle risotto: Giorgio Locatelli’s early summer recipes from Lombardy https://t.co/vcqC5ZGGDQ
guardian,Tiepolo Blue by James Cahill review – a bold debut of psychosexual awakening https://t.co/CeelN12d2D
guardian,"If she is ready, Steph Houghton deserves her place in England’s Euro 2022 squad | Suzanne Wrack https://t.co/yCNyBt9x8F"
guardian,Are the best days now behind Belgium’s golden generation? | Jonathan Liew https://t.co/uT13YriPZx
guardian,First post-Covid school leavers face fight for fewer university places https://t.co/MLxR11Sh1d
guardian,"Weekend podcast: Pete Doherty, Marina Hyde, and tips on making tough choices https://t.co/v1egbErBTA"
guardian,‘Dinosaurs are not us’: book reveals how mammals came to rule the world https://t.co/4L3yVKvT4v
guardian,Frontline workers: how has the cost of living crisis affected your work? https://t.co/DNeCfLrTUY
guardian,"There’s a new breed of young, violent, far-right activist in Britain: ‘white jihadists’ | Matthew Collins https://t.co/ROAgdde7TA"
guardian,Australian defence minister warns China risks sparking arms race https://t.co/misHS6Ije7
guardian,What links dental calculus with a ballet skirt? The Saturday quiz https://t.co/COkScxXe6w
guardian,"Russia-Ukraine war: ‘intense street fighting’ in Sieverodonetsk with both sides suffering heavy casualties, says UK – live https://t.co/yIoI1kdxM7"
guardian,ET the Extra-Terrestrial at 40: Spielberg’s sci-fi smash remains a wonder https://t.co/sxXXtGgXir
guardian,Bank cards: where have all the numbers gone? https://t.co/Qof39WLVEr
guardian,‘Thank you BET. Zero nominations again’: Lil Nas X says he’s too queer for Black awards show https://t.co/mpa3lYLXjJ
guardian,"Boris Johnson stands to make £5m a year after No 10, say experts https://t.co/OOhUzO3UkR"
guardian,Macho lumberjacks need not apply: young people wanted in UK forestry https://t.co/LkdAwpQB03
guardian,‘Labour sure to win Wakefield’: more tips from the Mystic Meg of politics https://t.co/rDvhsxEWdu
guardian,Western Bulldogs investigate star Bailey Smith over ‘white powder’ images https://t.co/tpEumjxOV1
guardian,Forecourts face up to three attempted fuel thefts a day as petrol prices soar https://t.co/dXaiERDd3d
guardian,How to turn spent coffee into a brilliant vegan dessert | Waste not https://t.co/ECqnVc3gzV
guardian,‘The return of banditry’: Russian car industry buckles under sanctions https://t.co/BLpVraAxkk
guardian,Aukus pact: Australia pays $830m penalty for ditching non-nuclear French submarines https://t.co/bUDTpXGrjt
guardian,Written warning on every cigarette in Canadian world-first https://t.co/tHYAyYihnr
guardian,"China will ‘start a war’ if Taiwan declares independence, says defence minister https://t.co/JOr19alFwC"
guardian,Russia-Ukraine war: what we know on day 108 of the invasion https://t.co/6tQoVmpf7C
guardian,NBA finals Game 4: Golden State Warriors v Boston Celtics – live! https://t.co/41Nnuc7oQd
guardian,Deep Throat at 50: the controversial film that pushed porn into the mainstream https://t.co/nFV6rVz2FT
guardian,"‘What a ball-buster!’ Juno Temple on sass, Ted Lasso and taking on the mafia https://t.co/IFTCp5O1FT"
guardian,Women’s Tour: Elisa Longo Borghini wins stage five to set up thrilling finale https://t.co/bTAenz5PLD
guardian,"Experience: I have collected more than 8,000 teapots https://t.co/dbgFtvP2FO"
guardian,The ‘trial’ in Donetsk has set a chilling precedent for conflict in the 21st century | Sadakat Kadri https://t.co/G0KuEZpJeL
guardian,"‘Indefatigable, curious, 100% original’: female artists on Paula Rego https://t.co/difYTFr7uV"
guardian,"Man arrested after boy, 15, stabbed to death in Manchester https://t.co/D6ab6QHe8m"
guardian,Knee problem forces Pope Francis to cancel Africa trip https://t.co/Yb8vUqrmco
guardian,Hopes fade of finding missing men as Brazilian police report finding ‘apparently human’ material https://t.co/v9p4cGKufC
guardian,Workers rescued after tumbling into vat of chocolate at Mars Wrigley factory https://t.co/qm18B4W2Z6
guardian,Leicester bid to cap turnaround with long-awaited Premiership final place https://t.co/RbAYDmedaz
guardian,The bioluminescent world of glowing lifeforms – in pictures https://t.co/0y7xF9u7ms
guardian,Nations League: Kylian Mbappé rescues draw for France against Austria https://t.co/dRSxWdUEVB
guardian,Māori moko facial tattoos revived by a new generation with designs on the future https://t.co/mb142Zl205
guardian,County cricket offers more runs for your money | Letter https://t.co/D9hn9ogPho
guardian,‘Muscles look cooler’: South Korean women reshape idea of beauty https://t.co/431qSOBjsC
guardian,New Zealand make hay as England suffer from winning good toss to lose | Simon Burnton https://t.co/jKYpGKbIdt
guardian,The week around the world in 20 pictures https://t.co/P42GJ4e5lm
guardian,Ben Stokes makes things happen before his well of miracles runs dry | Jonathan Liew https://t.co/6bWtu344qJ
guardian,Why do I forget the books I’ve read? We ask an expert https://t.co/7vfFCfBCuh
guardian,Dina Asher-Smith gives Commonwealth Games boost with race announcement https://t.co/dVaQvbWMcH
guardian,"Wrinkle-free linen? Good luck with that. Thankfully, it doesn’t matter | Jess Cartner-Morley https://t.co/WogXYkirlv"
guardian,‘A refreshing salad drink’: does balsamic vinegar and fizzy water really taste like healthy Coke? https://t.co/0k47mSizuC
guardian,"Stop worrying, Tim Dowling – age is a state of mind | Letter https://t.co/LVufWLG0qS"
guardian,Benjamina Ebuehi’s recipe for apricot limoncello mascarpone pudding | The sweet spot https://t.co/eBhhkJE1PW
guardian,Tyrannosaurus cheques? UK’s dino-industry pins hopes on Jurassic World Dominion https://t.co/i65hyZ9Yjs
guardian,Rules to be relaxed for foreign teachers to work in schools in England https://t.co/94dWG15d0U
guardian,Smart meters are not just ‘dumb’ but a scandalous waste of money | Letters https://t.co/FiN1QV2hOQ
guardian,Italy rematch prompts thoughts of what might have been for England | David Hytner https://t.co/4GVTWZsAWE
guardian,Gareth Southgate defends England style but pledges to not ‘outstay welcome’ https://t.co/o8oe1sb88j
guardian,Prince Charles criticises ‘appalling’ Rwanda migrant scheme – reports https://t.co/qt5KbE5Fs0
guardian,National Museum of Slovenia cancels art exhibition over alleged fakes https://t.co/9u9txP8poZ
guardian,"Sports quiz of the week: Wales, golf, Madrid https://t.co/sKbxHGGhwv"
guardian,Lewis Hamilton continues to set pace off F1 track in tackling big issues https://t.co/n15FfnxEWR
guardian,My Phantoms by Gwendoline Riley audiobook review – a portrait of mother-daughter resentment https://t.co/7YwNtsApiJ
guardian,Chess: Carlsen edges Mamedyarov after Anand makes one-move blunder https://t.co/hnu2uEkEtJ
guardian,Let’s go wild: 10 nature-based festivals in the UK https://t.co/tHgr6wK8G0
guardian,Huddersfield sink Leeds with first-half blitz to tighten grip on playoff spot https://t.co/p5w7kiuPAD
guardian,Henny Beaumont on Nadine Dorries and Boris the bungler – cartoon https://t.co/kCEIctpw7J
guardian,Finland and Russia: a photo journey through the border zone https://t.co/1JBYdPZtGZ
guardian,Cocktail of the week: Luca’s smaquiri - recipe | The good mixer https://t.co/znPOOym3fY
guardian,Frontline workers: how has the cost of living crisis affected your work? https://t.co/DNeCfLJvjy
guardian,Tory minister calls Birmingham and Blackpool ‘godawful’ https://t.co/8IrT7ImA0v
guardian,"Guardian front page, Saturday 11 June 2022: PM's food strategy 'a huge missed opportunity' https://t.co/arVWidME6u"
guardian,Report highlights ‘multiple failures’ in handling of Champions League final https://t.co/OyXQNFUuy5
guardian,You be the judge: should my boyfriend put his phone on silent? https://t.co/l7SQK7OeSC
guardian,Punishing heatwave expected across the US south-west this weekend https://t.co/DHBTxS79R0
guardian,Colbert on January 6 hearing: ‘exactly what you thought but worse than you could’ve imagined’ https://t.co/ihh6yEEqnM
guardian,How Macron’s Europe minister is at heart of brutal political battle in Paris https://t.co/heU7TCIJmj
guardian,Talking Horses: they’re off and it’s Sierra Nevada from Sierra Nevada … https://t.co/cWDQUWDIQ2
guardian,Bruce Kent’s prayers for peace in Belfast | Brief letters https://t.co/52vweFpXOG
guardian,Hoopla in Hertfordshire as Bryson DeChambeau joins the big money trail https://t.co/5qhU6H1L6w
guardian,Australia’s aged care homes urged to speed up fourth-dose Covid boosters as outbreaks and deaths rise https://t.co/UzGO6XHevw
guardian,"Majority of UK’s 366 monkeypox cases are in London, says health agency https://t.co/CIOQTnJ46C"
guardian,UK officials condemn Russian 'show trial' that sentenced two Britons to death – video https://t.co/qdjViC3CKt
guardian,MPs and wealthy landowners among beneficiaries of green subsidy https://t.co/QVcz6obZqN
guardian,How was the first January 6 hearing? Our panel weighs in | Panel https://t.co/hji9KZYSEp
guardian,Sarah Panitzke: UK’s ‘most wanted woman’ jailed over VAT fraud https://t.co/vclhlmZdKc
guardian,Lost photos from Spanish civil war reveal daily life behind anti-fascist lines https://t.co/stGu0KWja5
guardian,New Zealand batters thrive without Williamson and teach England lesson | Andy Bull https://t.co/eFLuE35khz
guardian,The Gunpowder Plot review – hit-and-miss history in subterranean London https://t.co/V9g9calq66
guardian,Chris Kirchner misses Friday deadline to prove he has funds for Derby takeover https://t.co/8mWJxWwmRv
guardian,Starcrossed review – gay romance riff on Romeo and Juliet is a giddy delight https://t.co/s522nDAoGk
guardian,What happened in the Russia-Ukraine war this week? Catch up with the must-read news and analysis https://t.co/bUT6OLP1KA
guardian,Defra report shows no stomach for bold action on food poverty and obesity https://t.co/bTTNpCtidt
guardian,New Zealand take charge of second Test with England left to rue missed chances https://t.co/CvkLDCos95
guardian,‘Worse than half-baked’: Johnson’s food strategy fails to tackle cost or climate https://t.co/eNQWeq7prm
guardian,The best recent science fiction and fantasy – review roundup https://t.co/vtyKC8B77k
guardian,A textbook definition of forgiveness – and why confession comes first | Letters https://t.co/NZ2Fy8ZaB2
guardian,There’s more to Abruzzo than montepulciano: the best wines from eastern Italy https://t.co/9pl582XtW8
guardian,"Austria v France, Denmark v Croatia and more: Nations League – live! https://t.co/tqrt6Xw5wO"
guardian,The Still Room review – a hideously misguided workplace sex comedy https://t.co/tOz5otwdph
guardian,"Since I moved in, my boyfriend will only sleep in our bed twice a week | Ask Annalisa Barbieri https://t.co/FSoCCIFLcb"
guardian,Should you cut your own hair? https://t.co/aRUmgm5c8I
guardian,The stark choice between a life with care or no life at all | Letters https://t.co/69YNmz83Qw
guardian,Covid infections on the rise in England and Northern Ireland https://t.co/W08glfe40R
guardian,Manchester United have €70m Frenkie de Jong offer rejected by Barcelona https://t.co/4nTWONQL4D
guardian,"Noci, London N1: 'Occasionally delicious, sometimes slapdash’ – restaurant review | Grace Dent on restaurants https://t.co/9VdTFykzwi"
guardian,Prosecutors ask for life sentences for 12 men at Paris attacks trial https://t.co/dmvuLkixkS
guardian,‘Like seeing a sculpture from a different angle’: Max Richter on rewriting The Four Seasons – for the second time https://t.co/tSOw8bF1hY
guardian,"UK deportation flight to Rwanda can go ahead, high court judge rules https://t.co/ohWyLn1hyt"
guardian,Kate Bush’s Running Up That Hill climbs higher than ever to No 2 in charts https://t.co/GwKyIXEVG9
guardian,Devon police launch investigation after two people die on lake https://t.co/w2l8dV2BqU
guardian,Ex-worker retracts claim YouGov suppressed positive Jeremy Corbyn poll https://t.co/SBsfczMP2y
guardian,"Drive slowly, change gear and read the road: how to make your petrol go further https://t.co/mXDM09M17V"
guardian,Indigenous groups scour forests and rivers for Dom Phillips and Bruno Pereira https://t.co/oJMXlsTHuo
guardian,"After the election results in California, the left must organize and fight | Ben Davis https://t.co/COWhqxGTaU"
guardian,"Airports must stop failing disabled passengers, says regulator https://t.co/SBpPRg2uP9"
guardian,"Meet mugwort, the prolific wild herb worth foraging for a treat | Alys Fowler https://t.co/FWahJNbXWu"
guardian,Ukraine’s high casualty rate could bring war to tipping point https://t.co/Ut75Wfa2q3
guardian,Tottenham agree deal to buy Djed Spence from Middlesbrough https://t.co/xNkKjQ0JQW
guardian,What happens when you don’t punish insurrectionists? | Steve Phillips https://t.co/PxYpcpAvkz
guardian,British Gas owner says rivals blocking plans to protect customer deposits https://t.co/mC5xZY4qe4
guardian,"Sports quiz of the week: Wales, golf, Madrid https://t.co/sKbxHGXSo3"
guardian,‘It was a disaster’: the tournament that made a mockery of Super League | By @NoHelmetsReq https://t.co/CnbSHDxunP
guardian,"Sports quiz of the week: Wales, golf, Madrid https://t.co/pCPFQDVw8W"
guardian,Gareth Bale calls for more player protection in face of ‘crazy’ schedule https://t.co/4h24KtH4Zr
guardian,Democrats promise more on Trump’s January 6 role after dramatic TV hearing https://t.co/g0Uww2fFeU
guardian,Server machine: UK restaurant chain Bella Italia trials robot waiter https://t.co/qNbCSIXCE1
guardian,"🆕A celebrity heart surgeon wins in Pennsylvania – what next?

In this week's episode of Politics Weekly America, @Freedland is joined by @JuliaTerruso to discuss the dramatic senate race in Pennsylvania.

🎧Listen wherever you get your podcasts⬇️

https://t.co/czFhp3ZtD5"
guardian,Frontline workers: how has the cost of living crisis affected your work? https://t.co/DNeCfLJvjy
guardian,"Trump’s forces are preparing for the next storming of the Capitol. This time, they plan to win | Jonathan Freedland https://t.co/SNV1lu5ZlL"
guardian,"Who is your food hero?

Last time @TommyBanks8 won your vote, but which chef, producer or activist is getting your nomination this year?

Tag your favourites below and vote: https://t.co/VtJHlfNyIp https://t.co/CIFkQJfzSX"
guardian,Liza Picard obituary https://t.co/C85vFDCITm
guardian,Council of Europe rebukes UK over Troubles immunity plan https://t.co/iCzEB7y15C
guardian,Primetime January 6 hearing shows set-piece TV can still pack a punch https://t.co/SSQs1L5pbA
guardian,Ukraine's Zelenskiy welcomes Ben Wallace in Kyiv – video https://t.co/hGsAszAJUw
guardian,"The Fiver | Northern Ireland, Billy Bingham and a life less ordinary https://t.co/uic7cGPu4Q"
guardian,Frontline workers: how has the cost of living crisis affected your work? https://t.co/DNeCfLrTUY
guardian,Tell us: share your views on the right to buy for housing association tenants https://t.co/bC6GBDfS55
guardian,Julee Cruise's angelic voice guided us through David Lynch’s American hell | Dorian Lynskey https://t.co/pUtt2ZU6kV
guardian,The diet that is right for you: putting a personalised nutrition app to the test https://t.co/ZxAxRaQcov
guardian,Even the Murdoch press is now waking up to the truth: Brexit was an act of self-harm | Michael Heseltine https://t.co/0jsvQfLPQw
guardian,The findings of the January 6 investigation are damning | Moira Donegan https://t.co/mGlT5C9Mad
guardian,Tell us: are you holidaying in the UK this summer?  https://t.co/tWHHe0VngC
guardian,Biden to end Covid testing requirement for travel into US https://t.co/RIs6BMKk1X
guardian,‘The cost has become absurd’: UK motorists lament £100-a-tank petrol https://t.co/cttsY99zHB
guardian,‘I was a misogynist’: Caroline Criado Perez on finding solutions to living in a man’s world https://t.co/yJefA6a8xS
guardian,Man shot and killed after scuffle with Alabama elementary school police officer https://t.co/BwaPFvnJnI
guardian,Tell us: are you holidaying in the UK this summer?  https://t.co/tWHHe0DMp4
guardian,"US inflation hits 40-year high of 8.6% as food, gas and shelter costs rise https://t.co/dZnqwgF0wV"
guardian,Ministers want Britain to be more like Netflix: debt-ridden and fast losing fans | Marina Hyde https://t.co/hwIh11xLdc
guardian,Ministers want Britain to be more like Netflix: debt-ridden and fast losing fans | Marina Hyde https://t.co/kIQ2xJjHeN
guardian,Costa book awards scrapped suddenly after 50 years https://t.co/0B4jggfSD0
guardian,US grapples with Trump’s role in Capitol attack after House panel airs evidence – live https://t.co/kV6gRWtLDg
guardian,Tories face tough test as they try to hang on to Tiverton and Honiton seat https://t.co/7WNUhmeAQc
guardian,Mark Rylance pulls out of three Jerusalem shows after brother’s death https://t.co/lB7QuzjyNF
guardian,Tell us: share your views on the right to buy for housing association tenants https://t.co/bC6GBDxttF
guardian,‘We ain’t in science-fiction any more!’ Laura Dern on the return of Jurassic Park https://t.co/Xsnx9B94BI
guardian,"As Boris Johnson alienates bosses, can Labour become the party of business? https://t.co/epp0WMWgRX"
guardian,"One in 500 men carry extra sex chromosome, research suggests https://t.co/z5oRHNfacp"
guardian,Texas school police chief says he didn’t think he was in charge during shooting https://t.co/TVzcuYscJg
guardian,"Home Office misled refugees about UN involvement in Rwanda plans, court told https://t.co/ndfdsae9Mo"
guardian,Stage flight: theatregoers aflutter after bat swoops into London show https://t.co/oudYiVVArZ
guardian,Two directors of care provider charged with criminal neglect over death of Ann Marie Smith https://t.co/l2NbHNMwMt
guardian,"🔜 The Football Weekly live tour is coming to Leeds!

@maxrushden and @bglendenning will be joined by Football Weekly favourites @jonawils &amp; @JohnBrewin_

📍 @CityVarieties | 13 June

Book your tickets here ⬇️
https://t.co/NDz2jvCfeI https://t.co/i9Yu5JYOvE"
guardian,A cannabis handout and a buzkashi match: Friday’s best photos https://t.co/c5Fh5POMST
guardian,EFL clubs allowed to wear away kits at home to help colour blind people https://t.co/0Yly7ol2Es
guardian,Simon Dobbin: five arrested on suspicion of murder seven years after assault https://t.co/kuxusqFTti
guardian,Oslo’s vast National Museum opens with tapestry of 400 reindeer skulls https://t.co/kUit8qGygt
guardian,Harlequins’ Cadan Murley embodies team belief before Saracens semi-final https://t.co/tEf6LNu1Nz
