handle,text
guardian,"‘I feel like I’ve got the best job in the world!’ – Amy Lennox, the knockout star of Cabaret https://t.co/2XkPLg9qTo"
guardian,‘So gorgeous you’ll shed tears of joy’: readers’ favourite beaches in Greece https://t.co/NPhgYv2uTF
guardian,One that got away: how close Liverpool came to buying Brazil’s Rodrygo for €3m https://t.co/AYp66sbIXa
guardian,Share your stories and pictures of UK Pride over the last 50 years https://t.co/WlB7NXSWfx
guardian,How Messy Millennial Woman became TV’s most tedious trope https://t.co/WaREByOmZx
guardian,"Tonight, join award-winning columnist @chakrabortty for a @guardianclass on how to find your voice as a writer, where you'll learn how to develop a strong and distinctive voice and how to grab readers' attention. Last few tickets available here https://t.co/OOyzdBkszt"
guardian,"UK shoppers cutting back even on essentials, warns Poundland owner https://t.co/rJWFBUhySu"
guardian,Paris police chief says his figure on Liverpool fans’ fake tickets may be wrong https://t.co/oLXo9StnIz
guardian,First Thing: Primetime January 6 Congressional hearings to begin | First Thing https://t.co/y3Kh9vRs5H
guardian,"Berlin crash driver had history of mental health problems, authorities say https://t.co/9uvQbqMqaZ"
guardian,Gove confirms plans to let people use housing benefit to buy homes https://t.co/m2kqamerUX
guardian,The best films of 2022 so far https://t.co/np0FyjVBsx
guardian,Made in Tredegar: the Welsh town that changed the world – video https://t.co/gC00vl8XZC
guardian,I bought a York City turnstile at auction. It’s the best £300 I’ve spent | By @NutmegMagazine  https://t.co/nX8xoeyq5m
guardian,"‘It is so easy to lose everything’: tales of poverty, despair and dignity at a Citizens Advice centre - The Guardian https://t.co/RBqsV38Wp3"
guardian,"Russia-Ukraine war: western weapons can win Sievierodonetsk battle, governor says; Zelenskiy issues grain warning – live https://t.co/zWFpdjG8qJ"
guardian,Baby formula shortage continues to distress parents as production resumes https://t.co/WG9yuSTSuD
guardian,"Climate policy dragged into culture wars as a ‘delay’ tactic, finds study https://t.co/QkyuTJ6T6r"
guardian,Arizona’s emergency services brace for triple-digit heatwave as deaths mount https://t.co/spYluBNfW8
guardian,Michael Gove rules out running for Tory leadership against Boris Johnson https://t.co/BI1k9AObE3
guardian,"🔜 The Football Weekly live Tour is coming to Birmingham!

@maxrushden and @bglendenning will be joined by @JohnBrewin_ and @_JordanJBryan

📍 @BMusic_Ltd | 15 June

Book your tickets here ⬇️
https://t.co/9xeooKvfUx https://t.co/5HZt0MSLDj"
guardian,Huge scale and impact of Israeli incursions over Lebanon skies revealed https://t.co/mIPf5rF8cL
guardian,US House passes gun control bill but it faces defeat in Senate https://t.co/znLLj3c2gA
guardian,Tell us: have you delayed retirement due to the rising cost of living? https://t.co/FJLPun1rm5
guardian,Dom Phillips: editors around world urge Bolsonaro to do more to find missing journalist https://t.co/BMaCuCg1vZ
guardian,Dall-E 2 mini: what exactly is ‘AI-generated art’? How does it work? Will it replace human visual artists? https://t.co/PiQ09cVbIA
guardian,Icy determination: on the trail of the Baikal seal – a photo essay https://t.co/o1MtbBUlU6
guardian,I bought a York City turnstile at auction. It’s the best £300 I’ve spent https://t.co/sfK8SfFb7r
guardian,Frontline workers: how has the cost of living crisis affected your work? https://t.co/DNeCfLJvjy
guardian,"65,000 year-old ‘Swiss Army knife’ proves ancient humans shared knowledge, research says https://t.co/UX0KREhaZt"
guardian,FirstGroup rejects £1.2bn takeover bid from US equity firm https://t.co/Ov3SldAkPj
guardian,How Minds Change by David McRaney review https://t.co/Vm91stQ0rC
guardian,Fight Night by Miriam Toews review – a war cry for rebellious women https://t.co/8D8nrsYRXS
guardian,Share your stories and pictures of UK Pride over the last 50 years https://t.co/WlB7NXSWfx
guardian,Why would Boris Johnson want to bring back imperial units? https://t.co/MBBO7bu9ky
guardian,Side hustles: what else Magnum photographers get up to – in pictures https://t.co/ORtM1XRe6I
guardian,Labour says some of Boris Johnson’s plans will make housing supply crisis ‘even worse’ – UK politics live https://t.co/STxT9eOdaI
guardian,Wallabies call on Japan-based trio for upcoming England Tests https://t.co/0ym6lcWQ7V
guardian,New Zealand sets up helpline for adults sexually attracted to children https://t.co/ioN6jX565w
guardian,"Sex, laughs and the snip: an audience with Thailand’s ‘Condom King’ https://t.co/jsJ7h52jAQ"
guardian,No easy ride for Biden as Kimmel tells him to ‘start yelling at people’ https://t.co/cpkImE0S3n
guardian,Share your stories and pictures of UK Pride over the last 50 years https://t.co/WlB7NXBkQX
guardian,The Black Sea blockade: mapping the impact of war in Ukraine on the world’s food supply – interactive https://t.co/kFVdLJ9yho
guardian,Ofgem fines energy firms £44m for ‘appalling’ Storm Arwen disruption https://t.co/6kucdCDMzM
guardian,Activists take water regulator Ofwat to court over sewage in English and Welsh rivers https://t.co/zW305QNCZO
guardian,‘It affected a great number of people’: inside the world of shocking military drug experiments https://t.co/EsUP0Di9Bx
guardian,"I took the train to Strasbourg, France – here’s my guide to the city https://t.co/QXhTm12wgd"
guardian,TV tonight: a magnetic Colin Firth gears up for the finale of The Staircase https://t.co/h8sTe2v4za
guardian,Labour frontbencher Lisa Nandy comes out in support of RMT strike https://t.co/uAcOuib5nx
guardian,Web3 in League Two? Crawley Town and the ‘crypto bros’ https://t.co/gHYEY6wM1g
guardian,Secret City: behind the untold gay history of DC politics https://t.co/IRBOGswiRS
guardian,UK economic growth to dry up; house buyer demand falls – business live https://t.co/oSoktzUuaj
guardian,Low-traffic neighbourhoods make roads safer but need a rebrand – report https://t.co/42XGeSS7Q4
guardian,EU regulators ‘dismissed evidence’ linking glyphosate to rodent tumours https://t.co/pf920VU7MG
guardian,A smart cabinet would be plotting to get rid of Johnson. This one is neither smart nor brave | Martin Kettle https://t.co/mCRSf4oa1w
guardian,Beetroot juice may aid people with coronary heart disease – study https://t.co/NBksez71B1
guardian,Republican media blitz aims to discredit Capitol attack hearings https://t.co/6gwOLdb4BW
guardian,New Zealand-born woman abused in Australian state care wins appeal against ‘501’ deportation https://t.co/wOb7uPET4O
guardian,Our entire civilisation depends on animals. It’s time we recognised their true value | Tony Juniper https://t.co/05xnuLhqiV
guardian,Fury at UN human rights chief over ‘whitewash’ of Uyghur repression https://t.co/ckkE9iUIGl
guardian,Mexican megachurch leader jailed in US for more than 16 years for child sexual abuse https://t.co/vl7z9myewH
guardian,"New $828m Sydney stadium to open with NRL, Wallabies and Matildas games https://t.co/9F6vWegG90"
guardian,Russia-Ukraine war latest: Zelenskiy says Sievierodonetsk seeing most difficult fighting so far in war – live https://t.co/wRrIRf6aVc
guardian,"Where did it go wrong for Chesa Boudin, San Francisco’s ousted progressive DA? https://t.co/W8aVRVM3bh"
guardian,Johnson: ‘Nothing and no one’ will stop me - podcast https://t.co/ZdyMHdEyHX
guardian,Global supply chain crisis fuels push to local manufacturing as China’s appeal dims https://t.co/XaQXPANnJI
guardian,Life in the firing zone: the occupation of Masafer Yatta – podcast https://t.co/dYiqeXpuxW
guardian,Fears for 11-year-old boy missing in Sydney’s north-west overnight https://t.co/I5fuYx90Jn
guardian,Ukrainian journalist confronts Russia’s Sergei Lavrov with grain theft claim https://t.co/WwYoeMX3gt
guardian,"‘She is dancing among the greats’: the dangerously honest, richly ambiguous Paula Rego https://t.co/DFxNpq7PIq"
guardian,NSW Blues say Isaah Yeo should have been taken off after State of Origin head knock https://t.co/iJWP4TmKTQ
guardian,Beneath what’s become the hidden pandemic lie tales of pain and anguish | Paul Daley https://t.co/MGuSRHNdHq
guardian,Russia-Ukraine war: what we know on day 106 of the invasion https://t.co/nkXDkXMasr
guardian,NBA finals Game 3: Golden State Warriors v Boston Celtics – live! https://t.co/d2HvrCIICO
guardian,Boris Johnson is unlikely to match Thatcher’s ‘right to buy’ revolution https://t.co/gd4vMAU5q1
guardian,TikTok investigating claims executive said he ‘didn’t believe’ in maternity leave https://t.co/9eOBKIP6gV
guardian,Gambling losses in online gaming very skewed to deprived areas – UK study https://t.co/LqtbLQVNP8
guardian,UK social mobility tsar wants focus on ‘small steps’ not giant leaps https://t.co/L6XNHrnXlq
guardian,Twitter set to comply with Elon Musk demand for data on fake accounts https://t.co/jJYzYbhRXt
guardian,John Lewis names sites for its ‘more than four walls’ newbuild flats https://t.co/p2uT02plww
guardian,The Guardian view on levelling up: a serious project meets a deeply unserious PM | Editorial https://t.co/XrveXoNlIh
guardian,How to make coronation chicken – recipe | Felicity Cloake's masterclass https://t.co/scw9QP0WHl
guardian,‘It’s a war on the people’: El Salvador’s mass arrests send thousands into despair https://t.co/hyvYQztRyg
guardian,Six ways with Asian greens: ‘They’re almost like a cross between spinach and broccoli’ https://t.co/eif0lYJuL0
guardian,'Sorry for the hurt': Mickelson defends Saudi-backed LIV Series but will not quit PGA Tour – video https://t.co/itLSl9zwqC
guardian,Euan Blair’s start-up for apprenticeships reaches £1.4bn value https://t.co/4btnXvT174
guardian,Trials of new Covid vaccine raise hopes of once-a-year booster https://t.co/RGXvZqEojH
guardian,The Quarry review – engrossing buffet of horror staples https://t.co/J4nHPM5mPK
guardian,Don’t Trust Your Gut by Seth Stephens-Davidowitz review – the problem with intuition https://t.co/61IgZhEs5T
guardian,Defeat against Ukraine extends Ireland’s long barren run in Nations League https://t.co/IY1cwchQKP
guardian,Boris Johnson hosts champagne party to celebrate sustainable UK fashion https://t.co/dLxE7aF2Lc
guardian,Jack Grealish’s Munich cameo showed freedom he feels with England https://t.co/1UejgNxouu
guardian,Gareth Southgate sticks to convictions and vows to block out criticism https://t.co/vGhxRuCjK2
guardian,Boris Johnson to focus on housing as economic storm clouds gather https://t.co/JpoDL67pUe
guardian,"UK economy ‘will grind to a halt’ and then shrink, BCC forecasts https://t.co/NT5itaIM7Q"
guardian,"Morning mail: cabinet meets amid rising cost-of-living concerns, plastic clean-up success, death rate fell in 2020 https://t.co/Vd7zyuxteb"
guardian,100-year-old Italian woman has driving licence renewed https://t.co/2N7qRn9kqC
guardian,Trevor Noah on New York passing stricter gun laws: ‘I didn’t even know that was possible’ https://t.co/udYfzAw7oa
guardian,Cleo Sol review – rare gig shows neo-soul star is a natural live performer https://t.co/aPPYxTE0ys
guardian,Wout Weghorst heads late winner as Wales slip to defeat by Netherlands https://t.co/lo1sgIAUsI
guardian,"Guardian front page, 9 June 2022: Fuel cost surge and dire economic forecast shatter PM's hopes of reset https://t.co/7gypNbFZD8"
guardian,Ralston and McKenna ease Scotland to cathartic win over Armenia https://t.co/pRSX1EAUSr
guardian,Ukraine: Captured Britons ‘face 20 years in jail’ https://t.co/jstYNo4wif
guardian,My mother in the garden swamped by green – Lydia Goldblatt’s best photograph https://t.co/wkLjJI0yoa
guardian,Amazon’s online luxury fashion stores open in Europe after US success https://t.co/jY5ZfElcoK
guardian,Sanjeev Gupta’s GFG Alliance fails to get winding-up order thrown out https://t.co/lWfYyLjM1l
guardian,'There are no beds': A&amp;E nurse warns of 13-hour waits in Essex hospital – video https://t.co/5Hw1nzhTZh
guardian,England going smoke-free by 2030 depends on No 10 willpower https://t.co/oClOVPSBBv
guardian,Donald Trump to testify in New York investigation into his business practices https://t.co/qwEcbnjCcs
guardian,"Duty of all NHS staff in England to fight discrimination, review says https://t.co/iCKG79hSBV"
guardian,Jack Leach ready for England action but Ollie Robinson out of Test series https://t.co/YIFcpeIHdK
guardian,Rectal cancer: researchers hail ‘breakthrough’ experimental treatment https://t.co/g3e01sdDeW
guardian,They’re not loyal babes: welcome to Tory Island – Stephen Collins cartoon https://t.co/6BS4p7RbBT
guardian,"Thieves stole Banksy Bataclan door mural with crowbar, French court told https://t.co/hj7OH6JN0v"
guardian,Report describes ‘fear and intimidation’ at Northumberland county councill https://t.co/bg4eTtwDIb
guardian,Canada: two died as police sought approval to tweet 2020 mass shooting warning https://t.co/wiiEIUl6co
guardian,We must join forces to defuse ‘carbon bombs’ | Letter https://t.co/fJusbC8cQB
guardian,"Bonnet de douche, Rodney! Del Boy becomes a literary work in court ruling https://t.co/Cgny1mvQo9"
guardian,Bruno Pereira: the dedicated defender of Indigenous rights missing in Brazil https://t.co/YPqdDfEiCq
guardian,Pelé joins calls for Brazil to step up search for pair missing in Amazon https://t.co/Z7Ty2CaNQS
guardian,"Billie Eilish review – still an icon of disaffected, hyper-creative youth https://t.co/73Bil9AzKF"
guardian,Lorna Miller on Conservative party animals – cartoon https://t.co/GEo7JukaeE
guardian,Zero-growth warning for UK economy as petrol prices surge https://t.co/catSiZjHo1
guardian,"Buy now, pay later boom ought to worry UK regulators https://t.co/n4TrBIS4vv"
guardian,Moscow’s chief rabbi ‘in exile’ after resisting Kremlin pressure over war https://t.co/TrWTMAir4v
guardian,Two missing after boat capsizes in Devon lake https://t.co/CTau5EOhpf
guardian,All My Friends Hate Me review – dark satire on quarterlife crisis from viral comedy duo https://t.co/ElkOKhz6Ae
guardian,Sajid Javid voices ‘cancel culture’ concerns as ‘blasphemous’ film pulled from UK cinemas https://t.co/RSDIHyP7ym
guardian,Fire at New York anti-abortion facility investigated as suspected arson https://t.co/FdwfOy84Vz
guardian,The Phil Mickelson Circus rolls into golf’s breakaway LIV Series https://t.co/iUiO3s4DkE
guardian,"Uvalde survivor, 11, tells House hearing she smeared herself with friend’s blood https://t.co/pcTyYTS9a5"
guardian,Starmer fails to electrify Commons after bum notes from prime minister unplugged | John Crace https://t.co/mWEpTOQqlR
guardian,MP denies voting to keep Johnson in return for Isle of Wight ‘bag of cash’ https://t.co/wlc0KkeBWS
guardian,Liverpool have doubts over neutrality of Uefa review – and its chair https://t.co/l9ohzRju3x
guardian,"Wales v Netherlands, Republic of Ireland v Ukraine: Nations League – live! https://t.co/3cZDeYLiby"
guardian,Tory rebels wait for Boris Johnson to ‘blow himself up’ to trigger fresh vote https://t.co/YnnR5gYQ8K
guardian,Australian death rate in first year of Covid pandemic was lowest on record https://t.co/CbYXQqBlLn
guardian,"Five Eyes must ramp up fight against rising organised crime, AFP commissioner warns https://t.co/rQTCKD4lkT"
guardian,Shedding light on turmeric stains | Brief letters https://t.co/DkXym4w103
guardian,Youpla funeral fund collapse: minister seeks advice on compensating victims https://t.co/k7qyj8VzF9
guardian,Rail strikes stance reflects Starmer’s more cautious approach to unions https://t.co/yPprdv7PnR
guardian,What is the LIV Golf Series and how will it work? https://t.co/XIRHtFtXb7
guardian,National Grid CEO’s £1.1m pay rise criticised as UK energy bills soar https://t.co/Fjw6r4HPZB
guardian,Beth Mead focused on England Euro success after Olympic snub https://t.co/sa55C5fAv0
guardian,Fury at government after council overruled on Surrey Hills gas drilling https://t.co/altj4SvIhJ
guardian,Ukraine and Russia ‘compete to be last army standing’ as Donbas deaths mount https://t.co/Wp2L7l7dIa
guardian,Rail strikes: when are they and how bad will the disruption be? https://t.co/GGqQJweHYW
guardian,Chelsea tell Romelu Lukaku he can join Inter on loan if the finances are right https://t.co/YhOREA6zGa
guardian,MEPs reject key EU climate proposal after aims watered down https://t.co/j6YaiTIhwo
guardian,Cumbrian councillors to vote on reversing infill of Victorian bridge https://t.co/YKWV4szmCj
guardian,Why do polling firms like YouGov tweak polls? Because they are scared of being wrong | Peter Kellner https://t.co/8y6934Rfd1
guardian,A Trump-style government in Britain? It’s already here | Letter https://t.co/cwfWyNOUjr
guardian,Why becoming a republic may be risky for Britain | Letters https://t.co/mO25yoyLaM
guardian,Alok Sharma in running to be UN’s global climate chief https://t.co/xG3xCDoEyL
guardian,Everton close to signing Burnley’s James Tarkowski after terms agreed https://t.co/GwYhDigRpu
guardian,US government to ban single-use plastic in national parks within a decade https://t.co/HaYIMdnwLe
guardian,Southgate finally proves he can throw some shapes on England’s dancefloor https://t.co/ctz0uyfeix
guardian,Al-Qaida in Indian subcontinent plans revenge attacks over prophet remarks https://t.co/vmFJP4wSBp
guardian,Thrifty summer: five ways to see the world for next to nothing https://t.co/bSSD2tV6Lk
guardian,Blatter and Platini trial: former Fifa president too unwell to testify on day one – video https://t.co/XzQtRP3stc
guardian,Ukrainian journalist challenges Lavrov on Russia's 'theft' from Ukraine – video https://t.co/VWskSKOLW7
guardian,Wales football supporters: how do you feel about qualifying for the World Cup? https://t.co/OWkw3ZEYLq
guardian,Laurel and Hardy review – a dream of slapstick and sadness https://t.co/emavQKgmDs
guardian,West to rebuke Iran over lack of cooperation with nuclear watchdog https://t.co/GmRxmPHTb8
guardian,Rainer review – a feverish rollercoaster ride around London https://t.co/IsqRQdD6Fl
guardian,The complete review of the Ligue 1 season | By @_Adam_White_ and @ericdevin_ https://t.co/n7oEMaPdg3
guardian,The Fiver | Jack Grealish freed from the shackles of tactical diktats https://t.co/OIUkEuofpx
guardian,Armed man arrested near Brett Kavanaugh’s home over threats to judge https://t.co/aGA7Tq3CtB
guardian,Fatal police shooting of woman in Paris sparks political row https://t.co/mQ3vGRagKx
guardian,Ian Poulter expects more big names to sign up for Saudi-backed LIV Series https://t.co/bj91jhTN2O
guardian,"UK will not impose direct rule on British Virgin Islands, Truss says https://t.co/awFHGpQxeZ"
guardian,"YouGov sat on 2017 poll as it was too positive on Labour, claims ex-employee https://t.co/oOwZ8usaHY"
guardian,Ms Marvel review – a glorious debut for the MCU’s first Muslim superhero https://t.co/DaZUdOspgK
guardian,Authorities in Brazilian Amazon arrest man in connection with missing journalist https://t.co/Fzd93jWDy5
guardian,Ireland's PM warns Downing Street against unilateral action on Northern Ireland protocol – video https://t.co/9IlVGDh5sN
guardian,Decision on lifting EU sanctions against Alisher Usmanov and his sisters expected soon https://t.co/v4B2KMdZ24
guardian,Three pay-as-you-go prices to rise by up to 250% for thousands of users https://t.co/BKupxfJijU
guardian,"‘I never lost the joy!’: singer Gilbert O’Sullivan on love, loss and lawsuits https://t.co/nABu9qDFLZ"
guardian,Andrew Gale wins unfair dismissal claim over Yorkshire exit https://t.co/Nm9Xeuu9Ys
guardian,US woman pleads guilty to leading all-female Islamic State battalion https://t.co/ARxyQen60P
guardian,West Ham open to Benrahma offers as they prepare to step up Lingard pursuit https://t.co/u75bTKZNld
guardian,I’m a Black gun owner. I have mixed feelings about gun control | Akin Olla https://t.co/0jqmMgxTE6
guardian,Met police authorised to charge Harvey Weinstein with indecent assault https://t.co/SNSGlxAFfB
guardian,Blondie open archive of unheard demos for box-set release https://t.co/ZiDl9sPf3w
guardian,"Racism, misogyny, homophobia, corruption: we want to fix the crisis in policing | The secret chief constable https://t.co/UllpMMeeog"
guardian,Here’s a simple way to tackle the cost of living crisis: raise the minimum wage to £15 a hour | Nadia Whittome https://t.co/fnz0wRFRxb
guardian,A railway market and a sea turtle: Wednesday’s best photos https://t.co/MKgdXT8SyB
guardian,"Ex-soldier killed Somerset neighbours after parking dispute, court hears https://t.co/7cEv3tKnTk"
guardian,Texas school shooting survivor to testify before Congress as supreme court rulings loom – live https://t.co/2QYlpfPzpQ
guardian,Sepp Blatter tells court he is too ill to testify on first day of trial with Platini https://t.co/6hkdIqTq5R
guardian,Feeling down? Maybe it’s your houseplants’ fault https://t.co/JlRxczBWDY
guardian,Scientists use food puzzles to show how otters learn from each other https://t.co/kFJ6Q2QAv1
guardian,Thailand to ease cannabis rules but smokers warned over smell ‘nuisance’ https://t.co/SUdg7OtrEB
guardian,"31,000 Russian troops have died in Ukraine, says Zelenskiy – video https://t.co/iGMtkGS2z4"
guardian,Boris Johnson: Tory MPs voted against me because of 'remarkable' government – video https://t.co/rspMJgh0Vg
guardian,Boris Johnson: Tory MPs voted against me because of 'remarkable' government – video https://t.co/z4PyzwvQnU
guardian,Russia and Turkey raise hopes of grain export corridor from Ukraine https://t.co/A6cdNnPwcm
guardian,Gracie Spinks: Derbyshire police officers face misconduct action after woman’s death https://t.co/AUKPnPN0zb
guardian,Yulia Tymoshenko on war in Ukraine: ‘It’s a chance for the free world to kill this evil’ https://t.co/EVTLiSmHXB
guardian,"Gareth Bale has offered to play for Getafe, Spanish club’s president claims https://t.co/I5HOK2CJaf"
guardian,England claw a draw in Germany – Football Weekly https://t.co/aSYyCOXmwz
guardian,A deadly ideology: how the ‘great replacement theory’ went mainstream https://t.co/nZ8mfPmW5M
guardian,"The Spin | The many ages of Joe Root, the England great who always finds a way https://t.co/rwdHp0IxIO"
guardian,Tell us: have you delayed retirement due to the rising cost of living? https://t.co/FJLPun1rm5
guardian,Home Office’s Rwanda deportation plans face high court challenge https://t.co/NZoljTyI9z
guardian,‘The worst law on earth’: why the rich love London’s reputation managers https://t.co/jzsvaGLpcV
guardian,"US tourist causes €25,000 damage by throwing scooter down Rome’s Spanish Steps https://t.co/jjKfNpisED"
guardian,"Ukraine forces may have to pull back in Sievierodonetsk, say leaders in Donbas https://t.co/LZuA4BCh6t"
guardian,Have your photos published in the Guardian’s letters pages https://t.co/ll3443FqG8
guardian,Sajid Javid criticises changes to NHS pages removing word ‘women’ https://t.co/3xxT3KSvVe
guardian,"Adverts claiming plastic grass is eco-friendly are not allowed, says ASA https://t.co/uGKrgPXb31"
guardian,FBI seizes retired US general’s electronic data over alleged illegal Qatar lobbying https://t.co/Hji51eNOG7
guardian,NHS A&amp;E nurse filmed warning patients of 13-hour wait to see medic https://t.co/nJYoCCjujs
guardian,Boris Johnson says ‘nothing and no one’ will stop him continuing as PM https://t.co/LbNqjUR9yR
guardian,Madonna casts Ozark’s Julia Garner to play her in biopic https://t.co/YDZR82qpmb
guardian,Zara owner’s sales jump by 36% as shoppers return to high streets https://t.co/WRj2ZwUeVX
guardian,Next generation: Brazil Women ready to build on legends’ achievements https://t.co/MBTwwq6L9g
guardian,People at risk of suicide facing deportation to Rwanda told to ‘do a sudoku’ https://t.co/loVUJ61uhi
guardian,People at risk of suicide facing deportation to Rwanda told to try sudoku https://t.co/1zO9LbWwLr
guardian,Phil Mickelson defends Saudi-backed LIV Series but will not quit PGA Tour https://t.co/qwg1lNRTpg
guardian,First Thing: Matthew McConaughey in emotional plea for gun control at White House https://t.co/AA3IXnEYl3
guardian,"🔜 Join @maxrushden and  @bglendenning for the live Football Weekly tour, starting with ⬇️

13 June, Leeds - @JohnBrewin_ &amp; @jonawils

15 June, Birmingham - @JohnBrewin_ &amp; @_JordanJBryan

Book your tickets here ⬇️
https://t.co/23iqIYxH50 https://t.co/E0iTuzw3gK"
guardian,"Where’s your favourite place to eat?

In 2019 @theoystermen won your vote, but which restaurant is getting your nomination this year?

Tag your favourites below and vote: https://t.co/VtJHlg59zX https://t.co/myUSr8VHew"
guardian,The complete review of the Ligue 1 season | By @_Adam_White_ and @ericdevin_ https://t.co/n7oEMaxCov
guardian,Price of UK petrol makes biggest daily jump in 17 years https://t.co/BuALuXYwMn
guardian,"Artist Paula Rego, known for her visceral and unsettling work, dies aged 87 https://t.co/oimRyPh98r"
guardian,It’s the Adam and Erics 2022! The complete review of the Ligue 1 season https://t.co/hpuP5mJPyD
guardian,PMQs: Boris Johnson faces the Commons for first time since winning confidence vote – live https://t.co/grr52pBKrh
guardian,Russia-Ukraine war: ‘fierce battles’ taking place in Sievierodonetsk as Ukraine refuses to concede the city – live https://t.co/9NlwkXYl7N
guardian,Wales football supporters: how do you feel about qualifying for the World Cup? https://t.co/OWkw3ZWAa0
