handle,text
guardian,Fake nudes: fashion embraces the return of photo-realistic nipples https://t.co/J8jY0Ej5og
guardian,Can Dwayne Johnson’s Black Adam rebuild the DC Extended Universe? https://t.co/H3UbQ1KSrM
guardian,Top two Uefa executives went to playoff final day after Champions League chaos https://t.co/Sm8Ci3q1IF
guardian,"Billy Bingham, former Northern Ireland manager and player, dies aged 90 https://t.co/3w8LzNEcpJ"
guardian,Top drama school apologises to Paapa Essiedu and Michaela Coel for ‘appalling’ racism https://t.co/Fu0QlwfszD
guardian,‘Unstoppable’: four-day week could be within reach for British workers https://t.co/uJAt8Qd7vs
guardian,Have your photos published in the Guardian’s letters pages https://t.co/ll3443nPhy
guardian,Brexit row could prompt exodus of senior scientists from UK https://t.co/zEQdIVe1UE
guardian,Russia-Ukraine war: Kremlin defends death sentences for captured Britons as UK calls it ‘egregious breach of Geneva convention’ – live https://t.co/G6KBWDw7Yh
guardian,Tell us: have you been affected by the UK monkeypox outbreak? https://t.co/KfyCksea5j
guardian,"Digested week: marmalade sandwiches, cross princes and counting medals https://t.co/IIvttqu1DR"
guardian,Boris Johnson wants tax cuts – but can he deliver them in time? https://t.co/mIo2su4AGN
guardian,"Feel the benefit: union workers receive far better pay and rights, Congress finds https://t.co/trYDornk70"
guardian,"Rising cost of living a worry for 77% of adults in Great Britain, says ONS https://t.co/UqAUaN0fKo"
guardian,"As America watched Capitol attack testimony, Fox News gave an alternate reality https://t.co/rRvCPBK1Tt"
guardian,TfL and Tram Operations Limited plead guilty over 2016 Croydon crash https://t.co/ObCUysjxTn
guardian,Burger and two fries? Russia unveils logo as it replaces McDonald’s https://t.co/7q78jFT08T
guardian,Sheryl Sandberg isn’t the first woman to realise that work in your 50s is no walk in the park | Gaby Hinsliff https://t.co/kdcVysSlYC
guardian,"Next week, don't miss award-winning journalist @DaniLavelle in conversation with @shattenstone as they discuss Lavelle's new book, Down and Out. A powerful memoir and probing investigation into the UK's homelessness crisis. 

Book tickets @guardianlive https://t.co/hbarlxHW1H"
guardian,James Brolin on building aeroplanes and wooing Barbra Streisand: ‘When I first saw her I went whoa!’ https://t.co/OvNMf3aCTm
guardian,Arsenal win race to sign Brazilian teenager Marquinhos in £3m deal https://t.co/5S8Rvqfx6g
guardian,Pitch perfect: how women’s football revolutionised the game – and changed my life https://t.co/jjjGV1jMGu
guardian,"Julee Cruise, singer and frequent David Lynch collaborator, dies aged 65 https://t.co/4RhptJLBmS"
guardian,Tell us: how have you been affected by rising petrol prices? https://t.co/eadkzjROHA
guardian,Ivanka Trump says she does not believe father’s claim 2020 election was stolen https://t.co/4yFLjcF13S
guardian,Australian soap opera Neighbours wraps up filming after 37 years https://t.co/pG6HqI8dfW
guardian,| First Thing https://t.co/maE98tHMu4
guardian,Apple and Google’s mobile browser ‘stranglehold’ may face UK investigation https://t.co/pv6JUf9IwH
guardian,'The highest honour': Salah and Kerr win PFA player of the year awards – video https://t.co/dzG0kexAVR
guardian,"Boy, 14, dies and mother injured after ‘ferocious’ stabbing in Manchester https://t.co/7Xatn4Uqvo"
guardian,Mog the Forgetful Cat review – a miaow-vellous musical treat https://t.co/cUwwItBlYV
guardian,Woman reunited with skates after 40 years in modern-day Cinderella story https://t.co/By1Re4GyyS
guardian,Cha Cha Real Smooth to House of Gucci: the seven best films to watch on TV this week https://t.co/YRoOa3yjAe
guardian,"Disabled people ‘systematically ignored’ on climate crisis, says study https://t.co/pkBqGFA90g"
guardian,‘World-class player’: Chelsea Women sign Kadeisha Buchanan from Lyon https://t.co/CLwKaa1zBs
guardian,"The Rolling Stones review – world’s greatest rockers are still a gas, gas, gas https://t.co/8PIZ1YYp6A"
guardian,"Elano: ‘It’s not money, it’s passion. It has made me see how beautiful football is’ https://t.co/uZeugbRsoD"
guardian,"England v New Zealand: second Test, day one – live! https://t.co/m1dSAzULcs"
guardian,"Home menopause tests are waste of time and money, say doctors https://t.co/uJksxZo33Q"
guardian,Draft bill to override Northern Ireland protocol to be published on Monday https://t.co/G6KBzHBQgh
guardian,Emma Raducanu must focus on long-term pursuit of glory as injuries take toll | Tumaini Carayol https://t.co/uXp7JLLfiN
guardian,"Boris Johnson will be forced out by autumn without ‘positive new agenda’, Lord Frost says – UK politics live https://t.co/rPkWKw0Bqu"
guardian,"UK’s largest lenders no longer ‘too big to fail’, says Bank of England https://t.co/tl0NeUakMU"
guardian,All in My Head by Jessica Morris review – an attempt to make the incurable treatable https://t.co/1t2bdqNR7R
guardian,Hacks season two review: the most vile – and pleasurable – comedy on TV https://t.co/Rrb3Soy6wN
guardian,"‘It takes away my melancholy’: liscio, the glamorous Italian club scene for older people https://t.co/tc2V2Neior"
guardian,"‘If you look at the bigger picture of change, aid has been close to irrelevant’ https://t.co/DH7AkoIbVm"
guardian,Tell us: have you been affected by the UK monkeypox outbreak? https://t.co/KfyCkrWzdL
guardian,"Julee Cruise, singer and frequent David Lynch collaborator, dies aged 65 https://t.co/wmQjVz3k3I"
guardian,The best podcasts of 2022 so far https://t.co/7K96YP3pd7
guardian,"Boris Johnson a bad role model for children, says social mobility tsar https://t.co/LRXV83GvA8"
guardian,Wreck of Royal Navy warship sunk in 1682 identified off Norfolk coast https://t.co/VnSfAONX8f
guardian,Liz Truss and Ukraine to discuss Britons’ death sentences for fighting Russia https://t.co/pxrV99VQoL
guardian,"Pomp and politics: Inside the 10 June @GuardianWeekly

Royal celebrations and a great escape.

Subscribe today: https://t.co/4NLrglt5sU https://t.co/Vc5uS9zjEy"
guardian,Alan Hall case: New Zealand begins unprecedented inquiry into ‘significant miscarriage of justice’ https://t.co/YQow9ajuw1
guardian,UK employers take on workers at slower rate after fall in applicants https://t.co/UjLYrP6HFy
guardian,Frontline workers: how has the cost of living crisis affected your work? https://t.co/DNeCfLJvjy
guardian,January 6 hearing: five key takeaways from the first primetime Capitol attack inquiry https://t.co/kkMxv0mIQk
guardian,Tell us: how have you been affected by rising petrol prices? https://t.co/eadkzjROHA
guardian,UK’s top banks not ‘too big to fail’; German growth forecast halved – business live https://t.co/poW6cx4wxA
guardian,‘Like killing my children’: former loggers now defend Assam’s forests https://t.co/3UmKjZIzrd
guardian,God’s Favourite Idiot to The Martha Mitchell Effect: the seven best shows to stream this week https://t.co/UNcZIOUFAr
guardian,Homes for sale with an orangery – in pictures https://t.co/Dv7AkdF2xw
guardian,"Using phosphorus from sewage could help with soaring food bills, says report https://t.co/7qVLkSC4UI"
guardian,Grenfell Tower legal costs on course to top £250m https://t.co/2z8ansiuTv
guardian,Socceroos seek to reward early risers in Australia with World Cup qualification https://t.co/UJe2jGtBJf
guardian,Florida’s manatees are dying in record numbers – but a lawsuit offers hope https://t.co/20QWkuUfZV
guardian,TV tonight: My Name is Leon is a beautiful story about a boy taken into care https://t.co/2TSbvi9mUt
guardian,Cocktail of chemical pollutants linked to falling sperm quality in research https://t.co/zS1Lx4ADVx
guardian,"Right in front of our eyes, Britain’s entire political order is being demolished | Aditya Chakrabortty https://t.co/1M7QtgBWGK"
guardian,House January 6 panel shows it still has surprises in store in televised hearing https://t.co/oYJxJiVUyW
guardian,Home Office tried to ‘sanitise’ staff education module on colonialism https://t.co/KrB1GRKall
guardian,Former head of ‘British FBI’ fears impact of Whitehall cuts on fight against crime https://t.co/tARBaZqLFR
guardian,I tried the DIY ‘healthy Coke’ that’s gone viral. Was it any good? https://t.co/lU74KG2wy7
guardian,Putin compares himself to Peter the Great in Russian territorial push – video https://t.co/Ip0NsbumDG
guardian,Travellers face lengthy delays at Sydney and Melbourne airports before long weekend https://t.co/EwXSwBvsTn
guardian,"Russia-Ukraine war latest: Ukrainian forces ‘holding on’ in key Donbas battles but losing up to 200 troops a day, Zelenskiy aide says – live https://t.co/wd1rgtvH3u"
guardian,Vivid retelling brings horror of January 6 back to scene of the crime https://t.co/eI0zyHZbn4
guardian,"Cultural issues ‘appear to impact’ Queensland police response to domestic violence victims, inquiry hears https://t.co/IbgEFJk9WG"
guardian,Goodie bag to promote US industry contained ‘Made in China’ gifts https://t.co/LS0pMge1pl
guardian,Capitol attack panel begins hearings to prove Trump was at heart of plot https://t.co/9mrdK5uq2R
guardian,"We’re almost out of ammunition and relying on western arms, says Ukraine https://t.co/QRBX1GZBRR"
guardian,‘Ironclad brothers’: what China wants from its role in Cambodia’s biggest naval base https://t.co/Hmb3sqFqOj
guardian,Britney Spears’s ex-husband crashes her wedding with Sam Asghari https://t.co/5ymbSzyfRZ
guardian,Sudden infant death syndrome: will parents finally get answers? – podcast https://t.co/OkAONwoI1j
guardian,Nasa forms independent team to study unexplained UFO sightings https://t.co/GnmxD77VFy
guardian,Russia-Ukraine war: what we know on day 107 of the invasion https://t.co/jX3KG0VYpS
guardian,Putin compares himself to Peter the Great in quest to take back Russian lands https://t.co/b4q4xIGLOt
guardian,"Capitol attack was ‘culmination of an attempted coup’, says panel chair.  

Follow live updates of the January 6 hearing: https://t.co/ZIgu53w3eY"
guardian,Rebel Wilson reveals she is dating a woman in Instagram post tagged #loveislove https://t.co/o5S9ToUE9y
guardian,"£4bn of NHS Covid PPE to be burned as it is unusable, says committee report https://t.co/ipbyPjeKdD"
guardian,Rishi Sunak ‘wasted £11bn by paying too much interest’ on UK debt https://t.co/k6FpinP859
guardian,"Anti-money laundering proposals ‘thundering disappointment’, say MPs https://t.co/H5DqcISKVB"
guardian,Sriracha lovers burned as maker halts production due to pepper shortage https://t.co/MhfjtzBixg
guardian,Patrick Lyoya: Michigan police officer charged with second-degree murder https://t.co/Hva2dxZNAo
guardian,Australia news live: Anthony Albanese hosts Jacinda Ardern; Nadesalingam family flies to Biloela https://t.co/aGA29WG90L
guardian,"Morning mail: Nadesalingams release gives hope, Britons sentenced to death, the ‘triple La Niña’ https://t.co/T86klbXHIt"
guardian,Chris Kirchner given Friday deadline to prove he can complete Derby takeover https://t.co/q1vtE2jUVH
guardian,Nations League roundup: Northern Ireland beaten in Kosovo and Spain win https://t.co/NCNzCkxbZA
guardian,Plus fours and black cabs: the first LIV Golf Series event – in pictures https://t.co/DJWGbq1LB7
guardian,"Guardian front page, Friday 10 June 2022: Low-paid care workers 'can't afford petrol to get to work' https://t.co/m3sYmGofpy"
guardian,"UK healthcare staff call in sick to avoid using car as cost of fuel soars, union says https://t.co/Xtb8AP0yP3"
guardian,"Multiple victims in shooting at Maryland business, police say https://t.co/mIf9omPjAV"
guardian,"Aston Villa, Leeds and Tottenham tussle for West Ham youngster Sonny Perkins https://t.co/cSkZuBDKgI"
guardian,The Wight way to have a great British holiday after giving up flying | Letters https://t.co/so67480ZJ4
guardian,Steve Reich: Reich/Richter review | Andrew Clements's classical album of the week https://t.co/stWiSSKEix
guardian,Anyika Onuora: ‘I couldn’t tell anyone – a lot of abuse in sport is swept under the rug’ https://t.co/tflT3dKa9c
guardian,Facebook fails test to detect violent hate speech in global ads – again https://t.co/twcZXI7PL3
guardian,Mohamed Salah and Sam Kerr win PFA player of the year awards https://t.co/aZKBkDXuah
guardian,'Millions could starve': Zelenskiy warns of global impact from Russian blockade in Black Sea – video https://t.co/LMaxf0PH8Q
guardian,Tesla investigation deepens after more than a dozen US ‘Autopilot’ crashes https://t.co/wlu1wMWvP1
guardian,UCL apologises for ‘bullying and sexual misconduct’ at architecture school https://t.co/3aj0cds1AD
guardian,We GPs are under immense strain because there aren’t enough of us | Letters https://t.co/Hn9d4Wq8Ya
guardian,Devon police recover two bodies after boat capsized on lake https://t.co/GZKC1X1Hhh
guardian,The no-show that irked fans of Gilbert O’Sullivan | Brief letters https://t.co/n1Br9eXoiL
guardian,A greener greenhouse: solar panels trialled on Wimbledon berries farm https://t.co/D9j76ZvOKA
guardian,Edinburgh International book festival announces new hybrid format https://t.co/qEvtxlYKJQ
guardian,I bought a York City turnstile at auction. It’s the best £300 I’ve spent | By @d_gray_writer https://t.co/nX8xoegPdO
guardian,Caroline Drummond obituary https://t.co/XcYS89I7gb
guardian,Washington Commanders coach sorry after calling Capitol attack a ‘dust-up’ https://t.co/pgQXeHoC5i
guardian,Steve Bell on the Boris Johnson’s Ukrainian Cossack painting – cartoon https://t.co/jGVpKJ43cg
guardian,Getting over the hassle of going out: ‘Select one or two things to start with’ https://t.co/49clfvU7aw
guardian,"Islamic State affiliate suspected of Catholic church massacre, Nigeria says https://t.co/kEsLBzwmLv"
guardian,Google misdirects one in 10 searches for abortion to ‘pregnancy crisis centers’ https://t.co/mTwyisHTGh
guardian,‘I won’t believe humans any more’: Johnny Depp releases self-penned ballad lamenting fame https://t.co/xyRji5hoj3
guardian,Bruce Kent obituary https://t.co/KISoNGZ0ne
guardian,Why the televised hearings on the January 6 insurrection will be historic | Robert Reich https://t.co/C9fBwBbSkG
guardian,"Boots is up for sale to the highest bidder, but where are they all? https://t.co/CShQj23qy0"
guardian,Most senior Uefa security officials ‘not actively involved’ in Champions League final control room https://t.co/DMTgfezW3E
guardian,Unseen works by ‘queen of gothic fiction’ Shirley Jackson published https://t.co/uOWChNvyii
guardian,Everyone is sick - illness in 2022 has medieval vibes | Brigid Delaney https://t.co/VD80WnVMLc
guardian,Reports of Calcot abuse prompt calls for reform of children’s social care in UK https://t.co/iN76sIQXIw
guardian,Premier League to issue football-wide bans for pitch invaders next season https://t.co/bAFNDtvMgO
guardian,The Guardian view on overriding the Brexit treaty: a national disgrace | Editorial https://t.co/Tq7jPlk2yN
guardian,Brady won’t rule out another no-confidence vote on Johnson within a year https://t.co/5nvmU7pgTw
guardian,Johnson wants us to talk about the NHS instead of his future. Let’s do just that | Polly Toynbee https://t.co/F8LNU9D8ot
guardian,"Switzerland v Spain, Portugal v Czech Republic: Nations League – live! https://t.co/cpsDn3Sf0K"
guardian,Javari valley: the lawless primal wilderness where Dom Phillips went missing https://t.co/b9J93axzkW
guardian,"Migrant women charged up to £14,000 for NHS maternity services in England https://t.co/G6EAsimVM5"
guardian,Cancelling Socrates review – Howard Brenton interrogates democracy in a rich play of ideas https://t.co/IXs1MZ3iSx
guardian,Women’s Tour cycling: Grace Brown powers into lead with stage four win https://t.co/hZGqtac0RQ
guardian,The revival of Live PD is a potentially dangerous reality TV backslide https://t.co/Mx1ohf3DI9
guardian,‘Chaos’: Australian doctors call for renewed focus on Covid-19 as winter sets in https://t.co/1j1XWMfoPy
guardian,David Squires on … the final hurdle in the Socceroos’ World Cup qualification bid https://t.co/ZrLlHlE3NT
guardian,"No sign of injury to officer from claimed stamping, say doctors, Sheku Bayoh inquiry hears https://t.co/8Oy972rqz5"
guardian,Bruce Kent: tributes paid as peace campaigner dies aged 92 https://t.co/R0kRv9jBrI
guardian,Who are the Britons condemned by Russian ‘show trial’ in Ukraine? https://t.co/C0DgZy97mo
guardian,Panel to connect Proud Boys and Oath Keepers in Capitol attack conspiracy https://t.co/IRkbeJo6Be
guardian,Please Fix the Road review – turn chaos to calm in this pleasing puzzle https://t.co/iO74dt35CY
guardian,Tories’ lazy stereotypes about ‘vegetarian Guardian readers’ are ripe for mockery | Letter https://t.co/J4kWSxR0ZS
guardian,‘I’m scared’: Florida faces uncertain abortion future as 15-week ban set to take effect https://t.co/pD1nMUviPO
guardian,"‘I was losing words. I didn’t remember the week before’: Beth Orton on chronic illness, MeToo and motherhood https://t.co/D4awlEEqfT"
guardian,Shakespeare First Folio copy estimated to fetch $2.5m in New York auction https://t.co/L7iKOyfHLK
guardian,Sue Barker announces that this year’s Wimbledon will be her last as presenter https://t.co/2zrAvb5vd8
guardian,Boris Johnson’s Blackpool speech illuminates Tories’ policy vacuum | John Crace https://t.co/Cedi9RTlDa
guardian,US justice department to investigate Louisiana State Police following 2019 death of Ronald Greene https://t.co/K3n4rwaIbm
guardian,"‘Extremely violent’ Paris final CCTV footage destroyed, French FA says https://t.co/SDemyJ20zv"
guardian,Tameside council chief resigns following tweet about Conservative voter https://t.co/MaZu5q7My1
guardian,Dom Phillips: sister of missing journalist still hopeful he will be found https://t.co/rJI8CjHq9H
guardian,The Fiver | Everton’s change of heart regarding betting companies https://t.co/UGBaDcfGAG
guardian,‘Monster’ neighbour jailed for at least 37 years for Gloucestershire murder https://t.co/iIIF2KEzGp
guardian,Galápagos tortoise species thought extinct for 100 years found alive https://t.co/mcw0sWzIFS
guardian,Nearly one in three children on free school meals in north-east England https://t.co/2pG1uJG3iM
guardian,"'He’s really hungry for the post and that counts for a lot'

In this week's Politics Weekly UK, @johnharris1969 talks to @DavidGauke and @rowenamason about whether it's conceivable that Boris Johnson will survive his latest political crises.  

Listen where you get your podcasts. https://t.co/FBIJvkN9yl"
guardian,Huge mystery spill detected in Baltic off Swedish coast https://t.co/cOgZ9SPc5U
guardian,TikTok addicts to benefit from in-app screen-time controls https://t.co/GxRVQ6gLd5
guardian,Tell us: how have you been affected by rising petrol prices? https://t.co/eadkzk9q6a
guardian,Tell us: have you delayed retirement due to the rising cost of living? https://t.co/FJLPumJQux
guardian,PGA Tour suspends all golfers competing at Saudi-backed LIV event https://t.co/W7S7fh0WII
guardian,Pressure mounts on Senate to act on gun safety amid Republican resistance https://t.co/ivphtcU2Ui
guardian,Johnson warns of 'wage-price spiral' if workers demand higher pay – video https://t.co/meNPE8fgVG
guardian,Scientists make ‘slightly sweaty’ robot finger with living skin https://t.co/iXInaP2A47
guardian,Irish exorcist calls for extra help for people oppressed by evil spirits https://t.co/vmXs6qi8oZ
guardian,'It was obviously a failure': Paris police chief apologises for Champions League chaos – video https://t.co/upAwJI0qj8
guardian,US Palestinian mission renamed and now reports directly to Washington https://t.co/IcWL1qtsS2
guardian,The west’s calls for a total victory in Ukraine can lead only to ruinous escalation | Simon Jenkins https://t.co/nCA4eEuaum
guardian,Seth Meyers on the televised January 6 hearings: ‘Fox will lie. It’s that simple’ https://t.co/tDlTal9v8L
guardian,"Backstage With Katherine Ryan review – there are laughs, but why does it feel so cringemaking? https://t.co/YKralqtygj"
guardian,‘It was the best day of my life!’ Guardian readers on Abba Voyage https://t.co/DVMP6PYovO
guardian,"Afghanistan war changed man who killed Somerset neighbours, court told https://t.co/xoYOs9Wnr0"
guardian,Fleetwood Mac’s Christine McVie: ‘Cocaine and champagne made me perform better’ https://t.co/H9gj4P4Ovp
guardian,Drugmakers urged to give poorer nations access to more antibiotics https://t.co/79v9M45nw8
guardian,"Cursed Child star Noma Dumezweni: ‘As a Black woman in acting, I’m fearless now’ https://t.co/HfwYUsWZ9Y"
guardian,"Removal of cameras at Iran nuclear sites may be ‘fatal blow’, warns UN watchdog https://t.co/110BYuFfBK"
guardian,Rail managers could join strike action across Britain https://t.co/9i3QXCEnNm
guardian,Republicans keep passing extreme anti-abortion bans without popular support. Here’s why https://t.co/tYO4TIPKaV
guardian,"‘Narcissistic’ UK politics putting EU relations at risk, says former British envoy https://t.co/uRC8RNJa4K"
guardian,Britons sentenced to death after ‘show trial’ in Russian-occupied Ukraine https://t.co/1cvb3dlYCz
guardian,"Police told Gaia Pope it would be traumatic to go to court after alleged rape, inquest hears https://t.co/F6XMZlnpEX"
guardian,‘All hell broke loose’: weary soldiers tell of frontline holdout in Ukraine city https://t.co/J0laaqp9YX
guardian,US braces for House committee’s primetime January 6 hearings – live https://t.co/MWl9IbZbZ9
guardian,Boris the Third: new play tells story of clown who became king https://t.co/Km9lm5A2no
guardian,Right to buy put homes in the hands of landlords. Rehashing it will do the same | Bob Kerslake https://t.co/01mLrqhgo1
guardian,Fossils found on Isle of Wight may be from largest ever spinosaur in Europe https://t.co/PW3OukKLpO
guardian,Li Jiaqi: Chinese influencer’s career hangs in balance after ‘tank cake’ stream https://t.co/NRJO9JkC83
guardian,Murdering the competition: Richard Osman thriller tops UK library loans https://t.co/0FLYlt9GFF
guardian,How should we change the game? – Football Weekly Extra https://t.co/VMrhYRArsl
guardian,Hitting reset: Boris Johnson’s attempts to reboot No 10 image https://t.co/vggWhwHhcd
guardian,European Central Bank to raise interest rates for first time since 2011 https://t.co/l1lLKa2RHo
guardian,Explosion at US natural gas plant raises risk of shortages in Europe https://t.co/RkO7oseD6Y
guardian,"It is in the best interests of Ukraine, and the West, to end this war as soon as possible | Christopher S Chivvis https://t.co/a4e8e9rMJ3"
guardian,"R Kelly should get at least 25 years in prison, prosecutors say https://t.co/86NJuFAQY0"
guardian,Boston kept faith when hard times hit. Now they’re two wins from a title https://t.co/AY4oYw1Rmy
guardian,Prisoner ‘on the run’ for three weeks appears on Birmingham podcast https://t.co/lOVzX9wKQZ
guardian,Asylum seekers may be released if Rwanda challenge succeeds https://t.co/MQBfOfVgSF
guardian,Boris Johnson warns of ‘wage-price spiral’ if workers demand higher pay https://t.co/m7z0mkjI0p
guardian,Mission accomplished? The meaning of Russia’s claimed land bridge to Crimea https://t.co/RERf6yUyHf
guardian,"Rape used ‘systematically’ during Lebanon’s civil war, report finds https://t.co/bQSUP1d81u"
guardian,Fury as Wizz Air boss suggests too many pilots refusing to fly when tired https://t.co/ZSRKQeoMXC
guardian,"Goodbye Divock Origi, Liverpool's never-to-be forgotten cult hero | Sachin Nakrani https://t.co/PAsN4GulL0"
guardian,"What comfort food does @ItsBigZuu have for @gracedent this week? 

The latest episode of #ComfortEatingPod is out now. 

Listen wherever you get your podcasts 🎧 

https://t.co/IZfortZMbi https://t.co/oG6HRH7jBX"
guardian,Judy Garland’s 20 best films – ranked! https://t.co/FraJ37xoYa
guardian,An LA protest and a tennis ball mosaic: Thursday’s best photos https://t.co/b93tcnl96x
guardian,Reliance Industries and Apollo Global Management in £5bn bid for Boots https://t.co/iOVB4lV7pk
guardian,Have your photos published in the Guardian’s letters pages https://t.co/ll3443nPhy
guardian,Florida man bit by alligator after mistaking reptile for ‘dog with a long leash’ https://t.co/zvySHsWyhM
guardian,JJ Abrams’ sci-fi series that was to be filmed in Northern Ireland cancelled https://t.co/QnG9QnVAyP
guardian,Frontline workers: how has the cost of living crisis affected your work? https://t.co/DNeCfLrTUY
guardian,Why filling up the average family car in the UK has topped £100 https://t.co/Hc3cttM3sX
guardian,Tell us: have you been affected by the UK monkeypox outbreak? https://t.co/KfyCksea5j
guardian,How does right to buy work and why is Boris Johnson planning to extend it? https://t.co/aN3BwnmT1U
guardian,Dining across the divide: ‘I was expecting a vegan wearing a European Union hat - one of those’ https://t.co/WwcwpaaLZt
guardian,Tell us: have you been affected by the UK monkeypox outbreak? https://t.co/KfyCkrWzdL
guardian,‘She could make anything part of a story’ – what Paula Rego chose to paint and why https://t.co/EYKrmPPK5K
guardian,Ex-soldiers ‘inspired by psychic to fight in Yemen’ go on trial in Germany https://t.co/dpCe5FvYnF
guardian,Everton sign betting sponsor deal two years after terminating similar contract https://t.co/YS2z9Uwrh4
guardian,Zelenskiy compares Russian invasion of Ukraine to Covid https://t.co/moOzYPuz50
