handle,text
JacksonLeeTX18,"After passage of this legislation today and the implementation of the Defense Production Act, I hope that we will be seeing the shelves in the stores in Houston Texas and elsewhere at the levels needed to feed and nourish these precious babies."
JacksonLeeTX18,"We must leave no stone unturned to ensure that we never have our families, mothers, fathers and their precious babies in this predicament ever again."
JacksonLeeTX18,"In addition, I cosponsored the legislation that  I promised that would allow WIC recipients to use their WIC cards for formula that is accessible even if it is not on their designated list."
JacksonLeeTX18,"Today, the President has enacted the Defense Production Act to ramp up domestic production of baby formula to get it on store shelves all over the nation."
JacksonLeeTX18,"Even after getting COVID, I remembered that I promised constituents that I met on last Saturday during the baby formula distribution that I would bring help as quickly as possible."
JacksonLeeTX18,I welcome the UAW today to the United States Capitol. Their union is truly a great contributor to the nation’s economy.  I thank the UAW for staying strong as a union during the pandemic. I will continue to support the UAW and all other Union workers.
JacksonLeeTX18,His  body armor enabled him to kill 10 people including a retired police officer who confronted him and who did not have the body armor this violent white nationalist had. Enact H.R. 40 Now! Enact Gun Safety Legislation Now. Racism is real and America has to deal with it Now!
JacksonLeeTX18,The nation must cure the disease of gun violence and the ability of an 18-year-old to get not only weapons of war…
JacksonLeeTX18,The courageous act of taking action on H.R. 40 in the midst of this mass murder of African Americans in Buffalo will show the nation is standing up to racists and racism.
JacksonLeeTX18,"One of the major cures for America is enacting H.R. 40, the Commission to Study and Develop Reparation Proposals for African Americans Act, so that the nation can show it is not afraid to talk about race and what happened to African Americans starting from slavery."
JacksonLeeTX18,The hatred displayed in Buffalo is a manifestation of the ever-present undercurrent of violence directed at African Americans by those who hold extreme racist views. White Supremacists and White Nationalists are documented as posing the greatest domestic terrorism threat.
JacksonLeeTX18,"Racism is real, and racism can result in bloodshed and murder just like what happened in Buffalo. White Supremacists and White Nationalists have projected violence and death on African Americans for generations."
JacksonLeeTX18,Statement: Congresswoman Sheila Jackson Lee tested positive for COVID. She is fully vaccinated and has received her boosters.  She encourages everyone to get tested and fully vaccinated along with their booster shots. She looks forward to a full and complete recovery.
JacksonLeeTX18,We need to pass real gun safety laws now to protect Americans.  Enough is enough!!!
JacksonLeeTX18,"Pass H.R. 40, the Commission to Study Slavery and to Develop Reparation Proposals. This senseless killing has caused much pain for the Buffalo community and the families of those who lost their lives and were injured."
JacksonLeeTX18,"Sad note that the NRA is coming to Houston, TX near Discovery Green where families come and play.  There are too many guns on the street and we must recognize that the hatred in America has to be healed. More knowledge about the history of Black people can make a difference."
JacksonLeeTX18,"It is a sad commentary in America when a person not even older than 20 becomes heavily armed with guns and goes to a Black grocery store in Buffalo, NY and shoots 13 Black people and 10 people are dead. The hatred mixed with the toxicity of guns must stop!"
JacksonLeeTX18,We will be providing COVID-19 testing and vaccinations on-site as well until 6PM. https://t.co/aTZq2ELqLC
JacksonLeeTX18,"If you’re in Houston and you need some baby formula, we’re here at Jack Yates High School until 6:00 PM today providing free formula to the community! https://t.co/CQRf9zBAnO"
JacksonLeeTX18,🚨🚨🚨🚨🚨🚨🚨🚨🚨🚨🚨🚨 https://t.co/UgkJnFYCmq
JacksonLeeTX18,"a woman's right to an abortion and a woman's right to human rights and freedom. However, the court is paramount, and I'm pleased to join this legislation and advocate for it to be passed swiftly and signed by the President.” - Congresswoman Sheila Jackson Lee"
JacksonLeeTX18,"“I was pleased to join Congressman Stanton in supporting new legislation to protect the Supreme Court Justices, the Clerks, and the Administrative Staff of the U.S. Supreme Court. Thousands of Americans have rightly disagreed with the potential overruling of eliminating…"
JacksonLeeTX18,Baby formula will be provided to mothers and families while there’s a baby formula shortage - drive-through distribution. All are welcome!
JacksonLeeTX18,🚨Join us tomorrow for a baby formula drive at Jack Yates High School! COVID-19 vaccines and testing will be provided on site. https://t.co/m2DFgn2MXk
JacksonLeeTX18,What happened to Brittney Griner is a crime. Free Brittney Now!
JacksonLeeTX18,"I am also glad to join with the Biden Adminstration, WNBA, women all over America, the Black Feminist Future to strongly demand Brittney’s freedom. She does not deserve and we will not tolerate this abuse like we saw today. Pray for her family and we will stand United."
JacksonLeeTX18,All of America will be fighting for Brittney and I am glad to join with my colleagues in the U.S. House of Representatives when we introduce legislation to help her. Free Brittney Now!
JacksonLeeTX18,There is no real legal system in Russia evidenced by the delay of her hearing today Friday for another 30 days.  She should be free now we demand her freedom. We demand her freedom because she is a victim of Putin’s desperation.
JacksonLeeTX18,It is obvious today that Russia is holding Brittney Griner as a political hostage  and we must fight to get her out. I am glad that she has now been determined to be under the jurisdiction of the State Department’s Hostage Negotiator.
JacksonLeeTX18,I will join with thousands of Houstonians and Americans to demand the release of Brittany Griner now; and other hostages wrongly held by Putin’s desperate leadership!” - Congresswoman Sheila Jackson Lee
JacksonLeeTX18,"“It is clear now that Brittany Griner is being used as a pawn by the Russian government, as I’ve always pushed for. It is now well known that she is being held without reason and purpose. The charges, if any, do not warrant her remaining in Russia. Free Brittany Griner now!!!"
JacksonLeeTX18,"Congresswoman Sheila Jackson Lee will be joined by NACC (a nonprofit) at Jack Yates High School located at 3650 Alabama Street, Houston Texas 77004, to help the Mothers and precious babies in the community to let them have some hope.  Press Conference at 2:30 pm."
JacksonLeeTX18,"Congresswoman Sheila Jackson Lee the chair and founder of the Congressional Children’s Caucus is working with the Adminstration to end the baby formula supply chain problem. Tomorrow, Saturday May 14, 2022, from 2:00-6:00 pm in Houston she will have a baby formula give away. https://t.co/qAU4C0F7En"
JacksonLeeTX18,https://t.co/J2qK9CJsBH
JacksonLeeTX18,https://t.co/y5KQcVjrzk
JacksonLeeTX18,"Congresswoman Sheila Jackson Lee hosting Chief Troy Finner during Police Week at the U.S. House in Washington DC. Also in recognition of Police Memorial Day on May 15, 2022, where we honor the bravery of fallen officers and their families.Congresswoman Sheila Jackson Lee https://t.co/fwH6wUZHlM"
JacksonLeeTX18,"We will win this fight, We will win this fight, WE WILL WIN THIS FIGHT WITH YOUR HELP!"
JacksonLeeTX18,…by  passing my Preventing Vigilante Stalking that Stops Women’s Access to Healthcare and Abortion Rights bill that will hold anyone criminally liable for interfering with women’s reproductive freedom.
JacksonLeeTX18,And we are also going to stop people from stalking women  and providers assuring that women have reproductive freedom
JacksonLeeTX18,"I will standup, march, and fight for Women’s Reproductive Freedom. My granddaughter will not face the fear, shame, or horrors that come when there is no medical care available when life and death circumstances warrant access to reproductive medical care and/or an abortion."
JacksonLeeTX18,Congresswoman Sheila Jackson Lee joins Speaker Pelosi on the steps of the U.S. Capitol fighting for Reproductive Rights. https://t.co/iL3HsWd2eK
