handle,text
Rep_Clyde,"I’m not either, @JackPosobiec.

Great work—this is why we fight! https://t.co/mMQL1IUcpX"
Rep_Clyde,"Dangerous drug seizures continue to skyrocket at the southern border.

Last month, CBP seized over 50,500 POUNDS of drugs—including nearly 1,300 lbs of fentanyl.

We must end the #BidenBorderCrisis NOW!"
Rep_Clyde,"Earlier today, I proudly joined a worship service outside the Supreme Court, where I prayed for the future of our nation and the sanctity of human life.

May God bless and protect our precious unborn! https://t.co/k4AnhhwwaP"
Rep_Clyde,"🚨 PAIN AT THE PUMP 🚨

Gas prices hit a new all-time average high of $4.52 per gallon—marking the eighth consecutive day of record high prices.

Biden’s war on American energy is hurting the American people. https://t.co/GDn6uXtWwH"
Rep_Clyde,"A record-breaking 234,088 illegal migrants were encountered at our southern border last month.

117,989 of them were released into the United States.

Biden’s open border policies continue to put Americans LAST."
Rep_Clyde,"Gas prices just hit a new all-time high of $4.48.

Americans can’t afford Biden’s anti-American energy agenda. https://t.co/2BqEPdmieo"
Rep_Clyde,"In Joe Biden’s America, it’s easier to find taxpayer-funded crack pipes than baby formula."
Rep_Clyde,"Joe Biden simply doesn’t care about the chaos his failed policies have created at our southern border.

Americans deserve better. https://t.co/KGppZAkGRw"
Rep_Clyde,"This is news to me, @LeaderHoyer, considering Congress hasn’t voted on a declaration of war. https://t.co/YNVa52cnrN"
Rep_Clyde,"Empty shelves for American mothers.

Pallets of baby formula for illegal migrants.

Joe Biden always puts Americans LAST."
Rep_Clyde,"American taxpayer dollars have NO business funding free phones for illegal migrants, period.

Proud to join @RepDonaldsPress on this legislation. https://t.co/4QbGiAKEeG"
Rep_Clyde,"This morning, I laid a wreath at the National Law Enforcement Officers Memorial in honor of fallen Jackson County Deputy Lena Marshall, who made the ultimate sacrifice while serving to keep Georgians safe.

God bless all our heroes in blue. 🇺🇸

#NationalPoliceWeek https://t.co/1yc8hSuTMz"
Rep_Clyde,"Biden just canceled oil and gas lease sales in Alaska and the Gulf of Mexico.

While Americans continue to face pain at the pump, Biden continues to advance his anti-American energy agenda."
Rep_Clyde,"Democrats rushed a vote on a $40B foreign aid package just 6 hours after introduction, but won’t hold a hearing for another two weeks on the baby formula shortage affecting millions of moms across the country.

Unreal.

Democrats are ALWAYS America Last."
