handle,text
RepDavidValadao,"Without access to water, the Central Valley can’t grow our nation’s food. With food prices rising &amp; global shortages a real possibility, we need to do everything we can to get more water to our domestic agriculture producers. Read more in @westerncaucus:
https://t.co/X2nT6uVrzO"
RepDavidValadao,"I was honored to meet the group of veterans taking part in the Central Valley Honor Flight this morning in DC. Thank you to these veterans for their service to protect our freedoms, and to all of the volunteers that help make this experience possible. #CA21 https://t.co/A8IEqeXgXQ"
RepDavidValadao,"I am proud to support our police officers here in the Central Valley. I wrote an op-ed for #NationalPoliceWeek on the importance of investing in our local law enforcement to protect our communities. 
 
Read more:
https://t.co/ZczGSwe7dz"
RepDavidValadao,"The baby formula shortage is an urgent crisis for parents across the country.

I joined my colleagues in requesting this administration and the @US_FDA take immediate action to address this problem.
https://t.co/dF8KDtKkxH"
RepDavidValadao,"We need to ensure police departments in the Valley have enough funding to properly recruit, train, and provide resources for their officers. I urge Speaker Pelosi to bring the Invest to Protect Act to the floor to give our officers the resources they need. #NationalPoliceWeek https://t.co/mHOTknD05U"
