handle,text
RepEspaillat,Babies can’t wait. Families need relief. I’m proud to vote for the #AccesstoBabyFormulaAct.
RepEspaillat,"Gracias @POTUS por su compromiso continuo con la comunidad cubanoamericana y sus familiares en Cuba. Revertir las restricciones de la era Trump y reemplazarlas con políticas fortalecidas basadas en los derechos humanos empodera al pueblo cubano.

https://t.co/txcKiZ8jVG"
RepEspaillat,"Ir al supermercado y ver estantes vacíos sin fórmula infantil es angustiante para cualquier padre.

Hoy, los @HouseDemocrats y yo votamos por un proyecto de ley que ayudará a #AlmentarANuestrosNiños al brindarle a la FDA los recursos que necesita para abordar esta escasez. https://t.co/vIkRrcOAFQ"
RepEspaillat,"Cuando invertimos en #HeadStart y #EarlyHeadStart, mejoran las habilidades lingüísticas, cognitivas y de alfabetización de los niños. Los niños reciben servicios de salud críticos y las familias reciben apoyo, lo que lleva a una vida más feliz y saludable. #FelizBDayHeadStart! https://t.co/CFRUxqIx4R"
RepEspaillat,"Thank you @POTUS for your ongoing commitment to Cuban-American community and their long-suffering family members in Cuba. Reversing Trump-era restrictions and replacing them with strengthened policies grounded in human rights empower the Cuban people. 

https://t.co/txcKiZ7M68"
RepEspaillat,"Going to the grocery store &amp; seeing empty shelves with no infant formula in sight is distressing for any parent.

Today, @HouseDemocrats &amp; I are voting for a bill that will help #FeedOurInfants by providing the FDA with the resources it needs to address this shortage. https://t.co/UQn6GY4v2N"
RepEspaillat,"When we invest in #HeadStart and #EarlyHeadStart, children’s language, cognitive, and literacy skills improve. Children receive critical health services while families receive community supports, leading to happier, healthier lives. #HappyBDayHeadStart! https://t.co/bZol33DSk3"
RepEspaillat,"Fue un gran honor unirme al presidente Biden hoy en la Casa Blanca para honrar al bombero del @FDNY Abraham Miller con la Medalla al Valor del Oficial de Seguridad Pública por su valentía y acciones heroicas para salvar vidas.

Bien hecho, oficial Miller.
https://t.co/EN3QTJ3Zn7"
RepEspaillat,"Visite https://t.co/7mD93Kmuhb para solicitar su próxima ronda de pruebas gratuitas de COVID-19 en el hogar.
¡Ordene la suya hoy mismo!

https://t.co/inSx0MRR4y"
RepEspaillat,"Hemos alcanzado un enorme progreso como para dar marcha atrás ahora: consulte el último aviso de #COVID19 y use una mascarilla en lugares públicos cerrados.

https://t.co/MO4yRGPMqr"
RepEspaillat,"Visit https://t.co/7mD93Kmuhb to order your next round of Free at-home COVID-19 tests.

Order yours today! https://t.co/inSx0MRR4y"
RepEspaillat,"I was delighted to join President Biden today at the White House to honor @FDNY Firefighter Abraham Miller with the Public Safety Officer Medal of Valor for his bravery and heroic actions to save lives. 

Well done, Officer Miller, and thank you for your service. https://t.co/EN3QTJ3Zn7"
RepEspaillat,We've made too much progress to turn back now -- checkout the latest #COVID19 advisory and wear a mask in indoor public settings. https://t.co/MO4yRGPMqr
RepEspaillat,Delighted to join the Albanian community of the Bronx at the ceremony and fair for the naming of a street in honor of Gjergj Kastrioti Skenderbeu. https://t.co/yUdaO1COdp
RepEspaillat,Feliz de compartir con la comunidad albanesa de El Bronx en la ceremonia y feria por el nombramiento de una calle en honor de Gjergj Kastrioti Skenderbeu. https://t.co/S2UuZoVFT2
RepEspaillat,"Desde las aulas físicas y el aprendizaje virtual: ¡gracias a nuestros increíbles maestros por reinventar la educación para garantizar que todos los niños tengan las mismas oportunidades de aprender, crecer, influir y liderar!

#TeacherAppreciationWeek https://t.co/39TPEaWbUn"
RepEspaillat,"¡Le deseo a mi increíble jefa de personal @AneiryBatista, un feliz cumpleaños muy especial! https://t.co/B980BTb1GE"
RepEspaillat,"Wishing my incredible chief of staff @AneiryBatista, a very special Happy Birthday! 🎉 https://t.co/rNFuujy67g"
RepEspaillat,"From the physical classrooms and virtual learning – thank you to our incredible teachers for reimagining education to ensure every child has an equal opportunity to learn, grow, influence, and lead! 

#TeacherAppreciationWeek https://t.co/rpWNhKeTa2"
RepEspaillat,"Hate crimes stun communities and devastate families.

These racially motivated acts of violence should not become so commonplace that we become complacent.

We must never stop fighting for gun reform - because too much is at stake."
RepEspaillat,"¡No deberíamos tener que esperar que ocurra el próximo tiroteo para implementar medidas para el control de las armas de fuego!

Estoy desconsolado por las familias de las víctimas y los transeúntes heridos en #Buffalo.

https://t.co/7ecFjYFF6X"
RepEspaillat,"Deseo agradecer a todos los residentes de mi distrito que me acompañaron en un ""Cafecito con el Congresista Espaillat"", la serie de evento que lacé para escuchar sus voces, examinar los problemas que enfrenta la comunidad y buscarles solución. https://t.co/PNsVrTOR8Q"
RepEspaillat,"Permítanme ser claro: como hombre, no tengo derecho a decirles a las mujeres qué hacer con su cuerpo.

Como funcionario electo, ¡mi lucha es para garantizar que tengan una opción! #BansOffOurBodies https://t.co/J0BZHbOY5e"
RepEspaillat,"Gracias a las abuelitas que cantaron a favor de los derechos reproductivos de las mujeres. 
--
Thanks to the grannies who sang in favor of women's reproductive rights. https://t.co/O41XW8SfQH"
RepEspaillat,"We shouldn’t have to wait for the next senseless shooting to implement gun safety measures! 

I'm heartbroken for the families of the victims and injured bystanders in #Buffalo.

My office is monitoring this situation closely as more details are provided by city officials. https://t.co/8rOTJiddgu"
RepEspaillat,"Let me be clear— As a man, I don’t have a right to tell women what to do with their bodies.

As an elected official, my fight is to ensure they have a choice! #BansOffOurBodies https://t.co/TuEZh2UNiO"
RepEspaillat,"I appreciate today’s collaboration with @CnDelarosa and @MannyDeLosSanto who are steadfast champions for our community.

We are stronger together and united! https://t.co/6wUEjxxJOj https://t.co/IWcFJTBiLv"
RepEspaillat,Thank you everyone who joined today’s kickoff of my “Coffee With Your Congressman” listening series! https://t.co/sjESnKrFV2
RepEspaillat,"La semana pasada, le dimos el último adiós al bombero caído del FDNY Timothy Klein, a quien perdimos en el cumplimiento del deber. 

La ciudad de Nueva York se levanta hoy en este Congreso para honrar su vida, su servicio y el recuerdo que Tim nos deja.
https://t.co/YfwVPANA4I"
RepEspaillat,"Hoy es el Día de los Niños de los Patriotas Caídos ―en el que honramos a los niños que dejaron atrás los valientes hombres y mujeres que dieron sus vidas mientras defendían nuestra libertad.

Ellos son el legado de la libertad. Que permanezcan siempre en nuestra memoria."
RepEspaillat,"Last week, we bid a final farewell to fallen FDNY Firefighter Timothy Klein, who we lost in the line of duty.

New York City rises today in this Congress to honor his life, his service—and the memory Tim leaves behind. https://t.co/oWKCIbmDPL"
RepEspaillat,"Today is Children of Fallen Patriots Day—where we honor the children left behind by the brave men and women who gave their lives while defending our freedom. 

They are the legacy of freedom, and may the memories of their loved ones never be forgotten."
RepEspaillat,"Buenas noticias: ¡Vuelve un café con tu congresista!

Asegúrate de participar con nosotros para analizar tus preocupaciones, sugerencias e ideas sobre cómo construir un distrito más fuerte y seguro para todos nosotros ―¡y trae a un amigo! https://t.co/glMNWDTQ93"
RepEspaillat,Les recuerdo amigablemente que todos los republicanos del Senado votaron en contra de codificar Roe ayer.
RepEspaillat,"Good news: Coffee with your Congressman is back on! 

Be sure to stop by to discuss your concerns, suggestions, and ideas on how to build a stronger, and safer, district for all of us—and bring a friend! https://t.co/mOnnvg80ro"
RepEspaillat,Your friendly reminder that every single Senate Republican voted against codifying Roe yesterday.
