handle,text
RepRussFulcher,"Charter schools provide a free, public education to families who choose to enroll in these schools. Limiting the growth of these institutions will harm students seeking learning options beyond the traditional public school system.

Read the full letter → https://t.co/E2uFhh5h2H https://t.co/sTE4RVys5t"
RepRussFulcher,"Coming up at 6:05am MT, I’ll be joining @kevinmillershow for this week’s Congressional Update.

🎙 Listen LIVE → https://t.co/9IcJPjAaxy"
RepRussFulcher,"Paul Arrington from the Idaho Water Users Association recently joined our @WesternCaucus forum to explain the economic impacts of the western drought, and what Idaho is doing to help mitigate these impacts . WATCH: https://t.co/uFehAzvjpd"
RepRussFulcher,"We all want to see our nation’s youth thrive. Every child deserves the opportunity to achieve success in life, and a second chance.

During my opening statement in today's @EdLaborGOP Subcommittee hearing, I spoke on improving America’s juvenile justice system: https://t.co/cdveS50wwT"
RepRussFulcher,"Congratulations to Kimberely Funk of Nampa, who was chosen as the 1st Place winner for the 2022 Idaho's First District Congressional Art Competition! The artwork will now be displayed in the U.S. Capitol alongside winners from all across the country. Great job Kimberely! #CAC2022 https://t.co/57RkvCizbT"
RepRussFulcher,"More than 1.2 million acres of land have fallen victim to wildfires so far this year. @NatResources Republicans have pleaded w/ committee leadership to take up legislation to address this crisis. Instead, they've doubled down on the failed strategy of locking up our lands. WATCH: https://t.co/6F6k1KyRQs"
RepRussFulcher,"The Stibnite project in Idaho represents the largest reserve of antimony outside of Russia or China, and could supply 35% of U.S. demand within the first six years of operation. But the bill proposed by Democrats today in @NatResources threatens the viability of this project. https://t.co/85csVoH1qg"
RepRussFulcher,President Biden's decision to cancel domestic oil and gas lease sales make one thing clear: he is not serious about combatting record-high gas prices. It is time for President Biden and his administration to end their war on American energy. https://t.co/kGDGhP0ll4
RepRussFulcher,"The ""defund the police"" movement has had deadly consequences:
• 346 officers shot, 73 killed in 2021
• 103 ambush-style attacks in '21, up 115% from '20
• New homicide records in over a dozen U.S. cities

Police deserve our appreciation and support. #NationalPoliceWeek https://t.co/ZyUrWiKp89"
