handle,text
SenSanders,The loudest voices in the Republican Party demanding that women be forced to give birth against their will are exactly the same people who oppose virtually every effort here in Congress designed to improve life for children and their mothers. https://t.co/kK2ehYmIoo
SenSanders,"This act of domestic terrorism by a racist, anti-Semitic white supremacist using an AR-15 should be a call to action. 

Let us finally pass common sense gun safety reforms. We cannot grow numb to this violence, and we must show our nation can come together to address this hatred. https://t.co/YKXIWlqaPk"
SenSanders,"No, Mr. Bezos. Disinformation is Amazon spreading anti-union propaganda &amp; forcing workers to attend illegal captive audience meetings. Disinformation is Amazon blaming a 17% price increase on ""inflation"" while making a record $35 billion in profits &amp; avoiding $5 billion in taxes. https://t.co/voJEB4ZTFR"
SenSanders,"The attack by Israeli forces against mourners at the funeral of Palestinian journalist Shireen Abu Akleh is an outrage. The United States must condemn this, and demand an independent investigation into her killing."
SenSanders,"Greed. Greed. Greed. While Americans are struggling at the pump, in the first three months of this year, 21 oil and gas companies made over $41 billion in profits, more than double their profits from last year. The problem is not inflation. The problem is corporate greed."
SenSanders,"The United States has the most dysfunctional, inefficient, bureaucratic and expensive health care system in the world. It’s time for Medicare for All.
https://t.co/rGwE13J45i"
SenSanders,"It is not acceptable that 68,000 Americans die each year because they cannot afford the health care they desperately need. It’s time to end this international embarrassment. It’s time to guarantee health care in the United States to all. It’s time for Medicare for All. https://t.co/BDdEnoN3cy"
SenSanders,"LIVE: No more insurance premiums. No more deductibles. No more co-payments. Health care is right, not a privilege. It’s time for Medicare for All. https://t.co/usC3ArZYIa"
SenSanders,"Today at 11am ET, we will hold the first ever hearing in a full committee of the U.S. Senate on Medicare for All. Health care is a right, not a privilege. https://t.co/NGGDheDApP"
