handle,text
RepJayapal,My heart breaks for families across Uvalde Texas who are in shock and mourning.No child should have to experience such a horrific attack. No teacher should have to be afraid of going to work. Enough is enough.
RepJayapal,Abortion care is health care. It's time for the Senate to end the filibuster and codify Roe. Health care decisions cannot and should not be made by politicians.
RepJayapal,"Thanks to the American Rescue Plan ""almost eight in 10 adults said last fall that they were either 'doing okay or living comfortably.'""Let's keep up this momentum and fight inflation by lowering the cost of housing health care child care and more!"
RepJayapal,I am so thrilled to see this announcement!By supporting climate innovation in typically underserved communities — we can bring together diverse voices and ideas to create the climate solutions of tomorrow.
RepJayapal,"""Last year saw the highest number of deaths as a result of active shootings...a whopping 171% increase from 2020.""How many people have to lose their lives before the Senate acts on gun safety reform? Enough is enough."
RepJayapal,I am sick and tired of politicians using immigrants as a political football.Title 42 is cruel racist and xenophobic. It's time for it to end.
RepJayapal,Meanwhile millions across this country and the world were pushed into extreme poverty.It's time to tax the rich.
RepJayapal,This is such great news and it's on top of over $29 billion in funding opportunities have already incorporated Justice40 considerations!
RepJayapal,It's time for insurance with no co-pays no deductibles and no premiums. Everyone in nobody out. It's time for Medicare for All.
RepJayapal,Domestic workers deserve the same workplace protections that other professions have.That's why I'm proud to lead the Domestic Workers Bill of Rights. Let's get this done.
RepJayapal,Canceling student loan debt would provide relief to nearly 45 million who owe an average $37014 per borrower.It's time to cancel student loan debt.
RepJayapal,"""Five of the largest energy companies are together making $2600 profit every second and there are now 62 new food billionaires.""This is disgusting. Those profiting off the pandemic and war by price-gouging must be held accountable."
RepJayapal,🌊 Flooding is getting worse.⛈ Storms are getting worse.🔥 Wildfires are getting worse.Just this weekend cities throughout the country broke daily heat records. Climate change is here and now and we're running out of time to act to keep our planet livable.
RepJayapal,This is great news. Thank you @POTUS!This will help hundreds of thousands of families get the formula they need — despite the best efforts of the 192 House Republicans who voted to try and block funding to alleviate this crisis.
RepJayapal,Just this past weekend 134 people across this country lost their lives to gun violence. Another 264 were injured.We shouldn't have to live under the constant threat of gun violence. It's time for the Senate to act and pass common sense gun safety reforms.
RepJayapal,Today Title 42 the racist and xenophobic public health law that's blocked millions of refugees and asylum seekers from entering the country was supposed to end.We must fight this ruling and restore our country as a beacon of hope.
RepJayapal,Abortion is health care. And if the GOP actually cared about parents and children they would support programs like the Child Tax Credit.
RepJayapal,The Senate must step up and codify Roe.Abortion rights are human rights and this is unacceptable.
RepJayapal,Today would be a great day to cancel student loan debt and lift this crushing weigh off of millions of borrowers.It's time.
RepJayapal,That’s right: cancel it.  Excellent article about collective responsibility and the tragedy of student debt. 
RepJayapal,It's the filibuster or gun reform.It's the filibuster or abortion rights.It's the filibuster or LGBTQ+ rights.The choice is clear. The Senate must end the filibuster.
RepJayapal,"ICYMI: The ""pro-life"" GOP voted AGAINST getting baby formula to families in need."
RepJayapal,People shouldn't have to be afraid to go into a grocery store a hair salon or a place of worship.This doesn't have to be the country we live in. It's time to pass gun safety reform. It can't wait any longer.
RepJayapal,This headline literally says it all.
RepJayapal,Throughout the pandemic millions have been expelled under Title 42. People fleeing famine violence and war. Our nation has failed them plain and simple.We cannot allow Title 42 a public health policy to continue to circumvent immigration law.
RepJayapal,Ginni Thomas actively tried to overturn the election.Justice Thomas MUST recuse himself from any and all cases regarding the 2020 election or insurrection. 
RepJayapal,Oklahoma already has one of the highest maternal mortality rates in the country.This isn't about protecting mothers and children — it's about controlling our bodies. This is why we must codify Roe.
RepJayapal,Today should be Michael Brown's 26th birthday.Instead he was taken from this world in an act of racism. Today in the wake of another brutal attack on Black Americans may his memory be a reminder to stand up to hatred wherever we see it.
RepJayapal,People shouldn't be expected to pay hundreds of thousands of dollars for necessary medical treatment. It's time for a system with no co-pays no deductibles and no premiums. It's time for Medicare for All.
RepJayapal,A friendly reminder that this week nearly every single House Republican voted against:❌ lowering gas prices❌ addressing the baby formula shortage❌ fighting domestic terrorism
RepJayapal,Families are struggling to keep food on the table while Big Oil is raking in record profits.This price-gouging is totally unacceptable.
RepJayapal,Yesterday Denton TX became the *100th* local government to endorse a Medicare for All health system!This is huge news and there's no question the momentum is building. It's time to pass Medicare for All and finally guarantee health care as a human right in this country.
RepJayapal,The GOP doesn't care about saving working families money.They just want a crisis to blame on Democrats.
RepJayapal,This is why we must codify Roe.Pregnant people in Oklahoma and across the country deserve to make their own health care decisions. Abortion is health care.
RepJayapal,Immigrants are a bedrock of our country.Title 42 is a xenophobic Trump-era public health law. It cannot and should not be continued to keep immigrants and refugees from seeking asylum in our country.
RepJayapal,Big Oil companies have been raking in record profits and paying off shareholders while pushing costs onto working families.Today the House is taking steps to fight back against this profiteering.
RepJayapal,Canceling student loan debt will provide a lifeline to millions. And the President can do it with the stroke of a pen. Let's get this done!
RepJayapal,Nearly two-thirds of Americans support keeping Roe in place.It's time for the Senate to step up and codify Roe. 
RepJayapal,"Why did 192 Republicans vote against funding to stop the formula shortage?Because they aren't actually the ""pro-life"" party — and being able to blame this crisis on the President and Democrats is more important to them than babies getting the formula they need. "
RepJayapal,The infant formula shortages we're seeing across the country are terrifying for new parents who rely on these products to keep their babies healthy.Today I'm proud to vote to pass emergency funding that will help fix this shortage quickly.
RepJayapal,When will enough finally be enough for the Senate to act?Gun violence and hatred are on the rise in our country — but sadly are nothing new. It's time to enact gun reform. There's no reason to have weapons of war on our streets.
RepJayapal,Exciting news! Today @EnergyCommerce is marking up my South Asian Heart Health Awareness and Research Act — a critical step before it can receive a full vote on the House floor.
RepJayapal,Codifying Roe isn't radical — what is radical is the Supreme Court taking health care decisions out of the hands of pregnant people.Roe is the law of the land and must be preserved. 
RepJayapal,There's no question Medicare for All isn't just good policy — it's incredibly popular.And this comes just days after the Senate held a historic hearing on this legislation. Let's keep up this momentum!
RepJayapal,"""That deadly toll — 9 million people each year — has continued unabated through 2019 killing more people than war terrorism road injuries malaria drugs and alcohol.""Investing in renewable and green energy will literally save lives. It's time."
RepJayapal,Today would be a great day to cancel student loan debt and deliver relief to millions of borrowers.
RepJayapal,This is such a powerful piece highlighting the fear that communities of color live with every day in this country.Every single person must stand up to racism and white supremacy wherever we see them.
RepJayapal,Equal pay for equal work! This is a big deal and it wouldn’t have happened without the incredible fighting advocacy of ⁦@mPinoe⁩ and all the women soccer players  who stood up! ✊🏾✊🏾⚽️⚽️ 
RepJayapal,Thank you @POTUS for clearly saying this. We must all stand up to hatred wherever we see it — especially as hatred is on the rise.
