handle,text
RepMarkPocan,My heart breaks for the fourteen kids and their teacher who lost their lives to gun violence today. Enough is enough.
RepMarkPocan,Save the date! 📅 I’ll be holding a Facebook Live Town Hall next Wednesday June 1 at 6:00 CT as we head into a very busy legislative session. I look forward to answering the questions that matter most to you. RSVP here!  
RepMarkPocan,Three cheers for the workers at Raven Software on their vote to form the Game Workers Alliance union! This new generation of workers are an inspiration to us all! #1u 
RepMarkPocan,Friendly reminder: your mental well-being is just as important as your physical health. Everyone deserves access to healthcare including affordable quality mental health support. #MentalHealthAwarenessMonth
RepMarkPocan,It's important for elected officials to be able to read their constituents. In this throwback #MagicMonday I show how it's done. 
RepMarkPocan,Tucker Carlson has been spewing racist tropes for years. To believe this he must be living in some alternate reality. 
RepMarkPocan,Big Oil is bringing in record profits while you pay more at the pump. It’s time they stop #RippingOffAmericans. I voted to lower prices by stopping price gouging penalizing market manipulation and bringing transparency to this secretive market.  
RepMarkPocan,Every worker should have a say in their workplace. Great to see workers across the country taking action. #1u 
RepMarkPocan,From the farm to the grocery shelves corporate profiteering and out-of-control consolidation has prices climbing.The Food and Agribusiness Merger Moratorium and Antitrust Review Act of 2022 will protect our farmers and our families. 
