handle,text
RepRichHudson,Border Security = National Security.#BidenBorderCrisis 
RepRichHudson,Severe weather is expected to continue impacting our region throughout this evening. I am monitoring reports of damage from earlier storms and urge everyone to follow local officials and remain safe. #ncwx 
RepRichHudson,A court ruling has delayed President Biden's plan to eliminate Title 42 border protections today. Ending Title 42 would make the #BidenBorderCrisis worse - even according to Biden's own Homeland Security Department.We must keep Title 42 and secure our border! 
RepRichHudson,Today is Armed Forces Day a time to honor our brave men and women at Fort Bragg and around the world serving in our military. Thank you for your courage sacrifice and dedication in defense of our nation! #MilitaryAppreciationMonth #ArmedForcesDay 
RepRichHudson,Washington Democrats have blamed COVID Putin and now price gouging for record gas prices — even though Biden's own Energy Secretary said there is no price gouging.The U.S. tried price controls in the 70's and it backfired.Instead let's unleash American energy! 
RepRichHudson,Read our full op-ed in the @WashTimes by @RepJimBanks and @TomColeOK04. We are focused on solutions and honored to lead @GOPLeader's Healthy Future Task Force along with @VernBuchanan and @RepGuthrie.
RepRichHudson,The pandemic and recent shortages show public health security is national security - and our nation deserves a better strategy to ensure we are prepared for future health threats.Our @HouseGOP Healthy Future Task Force is focused on solutions. Read more:
RepRichHudson,I am honored to help lead @GOPLeader's Healthy Future Task Force with @VernBuchanan &amp; @RepGuthrie.Read more from my op-ed with @RepJimBanks &amp; @TomColeOK04 on how we can strengthen our medical supply chain secure our borders from drug trafficking and hold China accountable: ⤵️ 
RepRichHudson,Today @HouseCommerce approved three bills I introduced to improve youth mental health reduce drugs costs and hold China accountable.I am glad our bipartisan KIDS CARE Act and other common sense legislation will now move to the full House. Read more:
