handle,text
VernBuchanan,Couldn’t have said it better myself. Thanks to @GovRonDeSantis for his dedication and tireless work on behalf of the great state of Florida. 
VernBuchanan,Unwanted illegal robocalls target Floridians far too often. Kudos to @AGAshleyMoody for taking action to target these scammers and protect our community from being swindled out of their hard-earned money. It's time to silence these calls once and for all.
VernBuchanan,Someone call the Guinness Book of World Records!Biden has done it again!Gas prices just hit a new all-time high for the 10th straight day in a row and every single state is paying more than $4 per gallon.This is what happens when you try to cripple the oil &amp; gas industry.
VernBuchanan,Pleased to see President Biden announce plans to:1. Use the Defense Production Act to ramp up domestic production of infant formula.2. Ship infant formula in from overseas.@SenRubioPress and I introduced legislation on Monday to do exactly that.
VernBuchanan,As co-chairs of @GOPLeader's Healthy Future Task Force @RepGuthrie and I are pleased to unveil solutions to combat future public health threats. Special thanks to @RepRichHudson @RepJimBanks &amp; @TomColeOK04 for leading the charge on these critical issues. 
VernBuchanan,Winning the economic war against China is essential for our future. That’s why I’m working to help the U.S. become the innovation and manufacturing capital of the world.Read my latest op-ed below ⬇️
VernBuchanan,Great news! My bill to help ensure student veterans are able to take advantage of the G.I. Bill credits they have earned and deserve just passed the House! I’m hopeful the Senate will soon take up this bill bringing it one step closer to becoming law. 
