handle,text
McConnellPress,.@LeaderMcConnell: Aid For Ukraine is an Investment In U.S. National Security https://t.co/olo6iUdYzo Video: https://t.co/kWNIlSN3qr
McConnellPress,Democrats have a different plan: Less production and higher prices. And Americans are paying for it every day: https://t.co/Ata9pXQA2v https://t.co/CJ4bOyvVah
McConnellPress,"The American people know exactly what we need: An all-American domestic energy strategy. Crude oil responsibly drilled in America, natural gas responsibly fracked in America, and more minerals and high-tech components responsibly mined in America: https://t.co/UWxz9obSRb"
McConnellPress,".@LeaderMcConnell: The average price of gas in America reached a new record high... From trips across town to visits with relatives, driving is becoming an even more painful proposition for working families. 
https://t.co/kmjFWLfwj8 https://t.co/tuXYT9lC3Z"
McConnellPress,"Democrats’ Historic Inflation Is Failing Families

@LeaderMcConnell's Senate floor speech: https://t.co/DkiU5vPeen Video: https://t.co/JLyyEUq1ny"
McConnellPress,Kentuckian nominated to TVA board https://t.co/tvAEDeItcX via @kytodayeditor
McConnellPress,".@WKDZ reports: @LeaderMcConnell praised the decision, and noted Judge White is the first Kentuckian nominated for the TVA Board under this Administration. As such, McConnell said he believes White will bring a “unique” Bluegrass perspective to the job. https://t.co/in2t46lYHB"
McConnellPress,.@LeaderMcConnell Applauds Nomination of Lyon County Judge-Executive Wade White to the TVA Board https://t.co/vkEA8TlMaZ @TVAnews @WPSDLocal6 @westkystar @PaducahSunNews
