handle,text
RepChrisStewart,"President Biden's State Department is publicly worried about secret nuclear activity in Iran, but he keeps negotiating with them anyway.

Trusting Iran without verification is bad policy. https://t.co/XIFsk8fx8C"
RepChrisStewart,"It was great to join my good friend @TGowdySC on @FoxNews to talk about America's national security.

Simply put, our defensive and offensive cyber capabilities need a serious upgrade. Vladimir Putin can't be allowed to have any advantage. https://t.co/DSAaR51l2Y"
RepChrisStewart,"Can't find baby formula for your newborn? Can't afford to fill up your gas tank? Don't worry, @POTUS will have new solar panels ready in no time...

https://t.co/bgaikxM7lh"
RepChrisStewart,"""We will accept nothing less than full victory."" 

- General Dwight D. Eisenhower, June 6, 1944.

78 years ago today, 156,000 American &amp; Allied soldiers stormed the beaches at Normandy. We owe those heroes a debt that can never be repaid. Their bravery will never be forgotten. https://t.co/s6ktI0rqrD"
