handle,text
RepMeijer,"There are challenges in the US that require new laws, and then there are challenges that demand existing laws be effectively enforced. Behind many troubling trends lie a hesitation by elected officials to ensure the law is obeyed. SF took a step in the right direction tonight. https://t.co/fFzJMpjJwT"
RepMeijer,"@SpeakSamuel @POTUS Yep. Have raised that every time @SecMayorkas came before @HomelandGOP cmte. We got massively delayed H-2B visa cap increases finally in mid-May, too late for many seasonal sectors that are getting crushed 🤦🏼‍♂️"
RepMeijer,"Would love to think @POTUS would put interests of American families first &amp; work to fight inflation by strategically lifting tariffs that raise prices for US consumers.

It’s sound policy + smart politics!

but sound + smart always lose against Biden-backing special interests… https://t.co/tWkRThVyhq"
RepMeijer,Today we mark the 78th anniversary of D-Day &amp; honor the men who ran down the Higgins boat ramps into blistering fire on the beaches of Normandy or who flew #MI03-built gliders into French hedgerow fields to cut off enemy resupply. Incredible bravery under exceptional leadership. https://t.co/7VPwaVa33v
