handle,text
firstrepublic,At First Republic Bank we strive to deliver extraordinary service at every opportunity. Thank you to our clients who shared their First Republic stories in our 2021 Annual Report. You inspire and motivate us. http http
firstrepublic,Remember honor and celebrate. Wishing everyone a meaningful memorable day. #memorialday http
firstrepublic,Five tips to build business credit. http
firstrepublic,What is a money order? http
firstrepublic,The S&amp;P 500 and Nasdaq enjoyed big weekly gains breaking a seven-week streak of declines. Read the full recap. http
firstrepublic,First Republic colleagues recently participated in the Memorial Day National Relay with Carry the Load. Thank you volunteers for your commitment to service. #TeamFirstRepublic http
firstrepublic,At First Republic we’re committed to enriching our communities. For over 20 years Gloria has been closely involved with nonprofit organizations as a volunteer. Thanks to dedicated people like her new and innovative projects can improve others’ quality of life. http
